numero,data,descrizione,assessorato,nomine,spesa,ddl,file,anno,RSSdate,datetime
412,29/12/2025,Deliberazione n. 412 del 29 dicembre 2025 -Revisione del Piano di Comunicazione Programma FSE + Sicilia 2021-2027. Regione Siciliana.,istruzione e formazione professionale,,,,https://www2.regione.sicilia.it/deliberegiunta/file/giunta/allegati/n.412_29.12.2025.pdf,2025,"Mon, 29 Dec 2025 00:00:00 +0000",2025-12-29
407,29/12/2025,Intesa Stato – Regioni. Riprogrammazione risorse con priorità Housing nell’ambito della Mid-term Review (MTR) dei programmi regionali della politica di coesione e revisione cronoprogrammi dell’Accordo per la coesione anno 2025. Presa d’atto,presidenza,,,,https://www2.regione.sicilia.it/deliberegiunta/file/giunta/allegati/N.407_29.12.2025.pdf,2025,"Mon, 29 Dec 2025 00:00:00 +0000",2025-12-29
402,19/12/2025,Convenzione di cui all’articolo 13 della legge regionale n.14/2019 e articolo 27 della legge regionale n. 16/2022 – Interventi in favore dell’aeroporto di Trapani Birgi,"turismo, sport e spettacolo",,,,https://www2.regione.sicilia.it/deliberegiunta/file/giunta/allegati/N.402_17.12.2025.pdf,2025,"Fri, 19 Dec 2025 00:00:00 +0000",2025-12-19
401,17/12/2025,Fabbisogno di personale presso il Dipartimento regionale dell&apos;acqua e dei rifiutidell&apos;Assessorato regionale dell&apos;energia e dei servizi di pubblica utilità,presidenza,,,,https://www2.regione.sicilia.it/deliberegiunta/file/giunta/allegati/N.401_17.12.2025.pdf,2025,"Wed, 17 Dec 2025 00:00:00 +0000",2025-12-17
400,17/12/2025,Bilancio consolidato del Servizio Sanitario Regionale - Anno 2023 - Approvazione,salute,,,,https://www2.regione.sicilia.it/deliberegiunta/file/giunta/allegati/N.400_17.12.2025.pdf,2025,"Wed, 17 Dec 2025 00:00:00 +0000",2025-12-17
399,17/12/2025,Gestione Sanitaria Accentrata (GSA) - Bilancio di esercizio - Anno 2023 - Approvazione,salute,,,,https://www2.regione.sicilia.it/deliberegiunta/file/giunta/allegati/N.399_17.12.2025.pdf,2025,"Wed, 17 Dec 2025 00:00:00 +0000",2025-12-17
398,17/12/2025,"Deliberazione 26 novembre 2025, n. 359: ‘Avviso “Progetti di valore: investimenti per la crescita sostenibile dei Comuni Siciliani” - Base giuridica’. Modifica",energia e servizi di pubblica utilita',,,,https://www2.regione.sicilia.it/deliberegiunta/file/giunta/allegati/N.398_17.12.2025.pdf,2025,"Wed, 17 Dec 2025 00:00:00 +0000",2025-12-17
397,17/12/2025,"Decreto legge 8 settembre 2021, n.120, convertito con legge 8 novembre 2021, n. 55. Delibera CIPESS 23 luglio 2025, n. 32 – Riparto somme",autonomie locali e funzione pubblica,,,,https://www2.regione.sicilia.it/deliberegiunta/file/giunta/allegati/N.397_17.12.2025.pdf,2025,"Wed, 17 Dec 2025 00:00:00 +0000",2025-12-17
396,17/12/2025,Ente Ecclesiastico “Opera San Giovanni Bosco in Sicilia” – Lavori di manutenzione straordinaria e di adeguamento ai fini della sicurezza dei locali adibiti alla formazione professionale presso l’istituto salesiano “San Giovanni Bosco” - Finanziamento a valere sulle risorse del capitolo 214920 del bilancio della Regione Siciliana,presidenza,,,,https://www2.regione.sicilia.it/deliberegiunta/file/giunta/allegati/N.396_17.12.2025.pdf,2025,"Wed, 17 Dec 2025 00:00:00 +0000",2025-12-17
395,17/12/2025,"«Atto di indirizzo per l’applicazione dell&apos;articolo 1, comma 165, della legge 30dicembre 2024, n. 207. Programmazione 2026».","agricoltura, sviluppo rurale e pesca mediterranea",,,,https://www2.regione.sicilia.it/deliberegiunta/file/giunta/allegati/N.395_17.12.2025.pdf,2025,"Wed, 17 Dec 2025 00:00:00 +0000",2025-12-17
394,17/12/2025,Piano Integrato di Attività e Organizzazione (PIAO) della Regione Siciliana 2025-2027. Modifica ed integrazione della Sezione 3.3.3.2. Approvazione,presidenza,,,,https://www2.regione.sicilia.it/deliberegiunta/file/giunta/allegati/N.394_17.12.2025.pdf,2025,"Wed, 17 Dec 2025 00:00:00 +0000",2025-12-17
393,17/12/2025,"Funzionalità dell’Amministrazione regionale – Atto di indirizzo del Governo per il differimento del termine di durata degli incarichi di dirigente di aree, servizi ed unità operative",presidenza,,,,https://www2.regione.sicilia.it/deliberegiunta/file/giunta/allegati/N.393_17.12.2025.pdf,2025,"Wed, 17 Dec 2025 00:00:00 +0000",2025-12-17
392,17/12/2025,Proposta di razionalizzazione degli assetti organizzativi dei rami dell’Amministrazione regionale,presidenza,,,,https://www2.regione.sicilia.it/deliberegiunta/file/giunta/allegati/N.392_17.12.2025.pdf,2025,"Wed, 17 Dec 2025 00:00:00 +0000",2025-12-17
391,09/12/2025,«Consorzio Universitario Archimede di Siracusa - Nomina componente del Consigliodi amministrazione con funzioni di Presidente».,istruzione e formazione professionale,Nomine,,,https://www2.regione.sicilia.it/deliberegiunta/file/giunta/allegati/N.391_09.12.2025%20con%20omissis.pdf,2025,"Tue, 09 Dec 2025 00:00:00 +0000",2025-12-09
390,09/12/2025,Consorzio Universitario di Trapani - Nomina componente del Consiglio di amministrazione con funzioni di Presidente,istruzione e formazione professionale,Nomine,,,https://www2.regione.sicilia.it/deliberegiunta/file/giunta/allegati/N.390_09.12.2025%20con%20omissis.pdf,2025,"Tue, 09 Dec 2025 00:00:00 +0000",2025-12-09
389,09/12/2025,"Programmazione triennale dei lavori e degli acquisti di beni e servizi ai sensidell’articolo 37 del decreto legislativo 31 marzo 2023, n. 36. Programma triennale2025-2027 - Approvazione",infrastrutture e mobilita',,,,https://www2.regione.sicilia.it/deliberegiunta/file/giunta/allegati/N.389_09.12.2025.pdf,2025,"Tue, 09 Dec 2025 00:00:00 +0000",2025-12-09
388,09/12/2025,«Avvio procedura per avviso pubblico di selezione per il conferimento degli incarichidi Direttore generale presso le Aziende e gli Enti del Servizio sanitario della RegioneSiciliana,salute,,,,https://www2.regione.sicilia.it/deliberegiunta/file/giunta/allegati/N.388_09.12.2025.pdf,2025,"Tue, 09 Dec 2025 00:00:00 +0000",2025-12-09
387,09/12/2025,"Dismissione di un bene immobile proveniente da procedura di sdemanializzazione ex articolo 27, comma 2, della legge regionale 7 maggio 2015, n. 9",presidenza,,,,https://www2.regione.sicilia.it/deliberegiunta/file/giunta/allegati/N.387_09.12.2025%20con%20omissis.pdf,2025,"Tue, 09 Dec 2025 00:00:00 +0000",2025-12-09
386,09/12/2025,"Dismissione di beni immobili provenienti da procedura di sdemanializzazione ex articolo 27, comma 2, della legge regionale 7 maggio 2015, n. 9",economia,,,,https://www2.regione.sicilia.it/deliberegiunta/file/giunta/allegati/N.386_09.12.2025%20con%20omissis.pdf,2025,"Tue, 09 Dec 2025 00:00:00 +0000",2025-12-09
385,09/12/2025,Intesa tra la Regione Siciliana e il Ministero degli Affari Esteri e della Cooperazione Internazionale per il rafforzamento e la competitività dei processi di internazionalizzazione per il sistema delle imprese siciliane,presidenza,,,,https://www2.regione.sicilia.it/deliberegiunta/file/giunta/allegati/N.385_09.12.2025.pdf,2025,"Tue, 09 Dec 2025 00:00:00 +0000",2025-12-09
384,09/12/2025,"Programma Regionale FESR Sicilia 2021/2027. Priorità 2 ‘Una Sicilia più verde’. Obiettivo Specifico 2.2 “Promuovere le energie rinnovabili in conformità della direttiva (UE) 2018/2001 sull’energia da fonti rinnovabili, compresi i criteri di sostenibilità ivi stabiliti” e Obiettivo Specifico 2.1 “Promuovere l&apos;efficienza energetica e ridurre le emissioni di gas a effetto serra”. Azioni 2.2.2 e 2.1.3. Rimodulazione finanziaria",presidenza,,,,https://www2.regione.sicilia.it/deliberegiunta/file/giunta/allegati/N.384_09.12.2025.pdf,2025,"Tue, 09 Dec 2025 00:00:00 +0000",2025-12-09
383,09/12/2025,PR FESR Sicilia 2021/2027. Politiche territoriali della Regione Siciliana per il periodo di programmazione 2021/2027. Schemi di Accordo di Programma e di convenzioni per le Aree Urbane Funzionali (FUA) e le Aree Interne (AI) per l’espletamento delle funzioni di Organismo Intermedio,presidenza,,,,https://www2.regione.sicilia.it/deliberegiunta/file/giunta/allegati/N.383_09.12.2025.pdf,2025,"Tue, 09 Dec 2025 00:00:00 +0000",2025-12-09
382,28/11/2025,Ente Parco delle Madonie - Nomina Presidente,territorio e ambiente,Nomine,,,https://www2.regione.sicilia.it/deliberegiunta/file/giunta/allegati/N.382_28.11.2025_con%20omissis.pdf,2025,"Fri, 28 Nov 2025 00:00:00 +0000",2025-11-28
381,28/11/2025,Consorzio Universitario di Agrigento denominato Empedocle - Nomina componente del Consiglio di amministrazione con funzioni di Presidente,istruzione e formazione professionale,Nomine,,,https://www2.regione.sicilia.it/deliberegiunta/file/giunta/allegati/N.381_28.11.2025%20con%20omissis.pdf,2025,"Fri, 28 Nov 2025 00:00:00 +0000",2025-11-28
380,28/11/2025,Istituto Autonomo per le Case Popolari (IACP) di Caltanissetta - Nomina Presidente,infrastrutture e mobilita',Nomine,,,https://www2.regione.sicilia.it/deliberegiunta/file/giunta/allegati/N.380_28.11.2025%20con%20omissis.pdf,2025,"Fri, 28 Nov 2025 00:00:00 +0000",2025-11-28
379,28/11/2025,"Copertura finanziaria ed iscrizione delle relative somme per gli oneri discendenti dalle previsioni di cui al comma 4-ter e 4-quater dell’articolo 64 della legge regionale 12 agosto 2014, n. 21. Esercizi finanziari 2025-2026-2027-2028","famiglia, politiche sociali e del lavoro",,Spesa,,https://www2.regione.sicilia.it/deliberegiunta/file/giunta/allegati/N_379_28.11.2025.pdf,2025,"Fri, 28 Nov 2025 00:00:00 +0000",2025-11-28
378,28/11/2025,"«PR FESR Sicilia 2021/2027. Modifica del Documento “Metodologia e criteri diselezione delle operazioni”. Azione 1.3.2, Sub-Azione 1.3.2.C, Azione 2.2.5, Priorità8 e 9 (STEP), Priorità 10 (RESTORE), Priorità 11-12-13-14 inserite con lariprogrammazione di medio termine (MTR)».",presidenza,,,,https://www2.regione.sicilia.it/deliberegiunta/file/giunta/allegati/N.378_28.11.2025.pdf,2025,"Fri, 28 Nov 2025 00:00:00 +0000",2025-11-28
377,26/11/2025,"Riconoscimento di evento climatico avverso assimilabile a calamità naturale nel settore della pesca con riferimento ai cosiddetti ‘piccoli pelagici’ – Schema di Avviso pubblico per la concessione di contributi a valere sul Fondo di solidarietà regionale della pesca e dell’acquacoltura, di cui all’articolo 39 della legge regionale 20 giugno 2019, n. 9 e successive modificazioni. Apprezzamento","agricoltura, sviluppo rurale e pesca mediterranea",,,,https://www2.regione.sicilia.it/deliberegiunta/file/giunta/allegati/N.377_26.11.2025.pdf,2025,"Wed, 26 Nov 2025 00:00:00 +0000",2025-11-26
376,26/11/2025,«Ente Parco dei Nebrodi - Nomina Presidente»,territorio e ambiente,Nomine,,,https://www2.regione.sicilia.it/deliberegiunta/file/giunta/allegati/N.376_26.11.2025_con%20omissis.pdf,2025,"Wed, 26 Nov 2025 00:00:00 +0000",2025-11-26
375,26/11/2025,Ente parco fluviale dell&apos;Alcantara - Nomina Presidente,territorio e ambiente,Nomine,,,https://www2.regione.sicilia.it/deliberegiunta/file/giunta/allegati/N.375_26.11.2025%20con%20omissis.pdf,2025,"Wed, 26 Nov 2025 00:00:00 +0000",2025-11-26
374,26/11/2025,Ente Parco dell’Etna - Nomina Presidente,territorio e ambiente,Nomine,,,https://www2.regione.sicilia.it/deliberegiunta/file/giunta/allegati/N.374_26.11.2025%20con%20omissis.pdf,2025,"Wed, 26 Nov 2025 00:00:00 +0000",2025-11-26
373,26/11/2025,Consorzio Universitario Mediterraneo Orientale (CU.MO) di Noto (SR) - Nomina componente del Consiglio di amministrazione con funzioni di Presidente,istruzione e formazione professionale,,,,https://www2.regione.sicilia.it/deliberegiunta/file/giunta/allegati/N.373_26.11.2025_con%20omissis.pdf,2025,"Wed, 26 Nov 2025 00:00:00 +0000",2025-11-26
372,26/11/2025,Consorzio Universitario di Ragusa - Nomina Componente del Consiglio di amministrazione con funzioni di Presidente,istruzione e formazione professionale,,,,https://www2.regione.sicilia.it/deliberegiunta/file/giunta/allegati/N.372_26.11.2025_con%20omissis.pdf,2025,"Wed, 26 Nov 2025 00:00:00 +0000",2025-11-26
371,26/11/2025,Consorzio Universitario di Caltanissetta - Nomina Componente del Consiglio diamministrazione con funzioni di Presidente,istruzione e formazione professionale,Nomine,,,https://www2.regione.sicilia.it/deliberegiunta/file/giunta/allegati/N.371_26.11.2025%20con%20omissis.pdf,2025,"Wed, 26 Nov 2025 00:00:00 +0000",2025-11-26
370,26/11/2025,Istituto Autonomo per le Case Popolari (IACP) di Trapani - Nomina Presidente,infrastrutture e mobilita',Nomine,,,https://www2.regione.sicilia.it/deliberegiunta/file/giunta/allegati/N.370_26.11.2025%20con%20omissis.pdf,2025,"Wed, 26 Nov 2025 00:00:00 +0000",2025-11-26
369,26/11/2025,Istituto Autonomo per le Case Popolari (IACP) di Siracusa - Nomina Presidente,infrastrutture e mobilita',Nomine,,,https://www2.regione.sicilia.it/deliberegiunta/file/giunta/allegati/N.369_26.11.2025%20con%20omissis.pdf,2025,"Wed, 26 Nov 2025 00:00:00 +0000",2025-11-26
368,26/11/2025,Istituto Autonomo per le Case Popolari (IACP) di Ragusa - Nomina Presidente,infrastrutture e mobilita',Nomine,,,https://www2.regione.sicilia.it/deliberegiunta/file/giunta/allegati/N.368_26.11.2025%20con%20omissis.pdf,2025,"Wed, 26 Nov 2025 00:00:00 +0000",2025-11-26
367,26/11/2025,«Istituto Autonomo per le Case Popolari (IACP) di Palermo - Nomina Presidente»,infrastrutture e mobilita',Nomine,,,https://www2.regione.sicilia.it/deliberegiunta/file/giunta/allegati/N.367_26.11.2025%20con%20omissis.pdf,2025,"Wed, 26 Nov 2025 00:00:00 +0000",2025-11-26
366,26/11/2025,Istituto Autonomo per le Case Popolari (IACP) di Messina - Nomina Presidente,infrastrutture e mobilita',Nomine,,,https://www2.regione.sicilia.it/deliberegiunta/file/giunta/allegati/N.366_26.11.2025%20con%20omissis.pdf,2025,"Wed, 26 Nov 2025 00:00:00 +0000",2025-11-26
365,26/11/2025,Istituto Autonomo per le Case Popolari (IACP) di Enna - Nomina Presidente,"agricoltura, sviluppo rurale e pesca mediterranea",Nomine,,,https://www2.regione.sicilia.it/deliberegiunta/file/giunta/allegati/N.365_26.11.2025_con%20omissis.pdf,2025,"Wed, 26 Nov 2025 00:00:00 +0000",2025-11-26
364,26/11/2025,Istituto Autonomo per le Case Popolari (IACP) di Agrigento - Nomina Presidente,infrastrutture e mobilita',Nomine,,,https://www2.regione.sicilia.it/deliberegiunta/file/giunta/allegati/N.364_26.11.2025_con%20omissis.pdf,2025,"Wed, 26 Nov 2025 00:00:00 +0000",2025-11-26
363,26/11/2025,Istituto Autonomo per le Case Popolari (IACP) di Acireale - Nomina Presidente,infrastrutture e mobilita',Nomine,,,https://www2.regione.sicilia.it/deliberegiunta/file/giunta/allegati/N.363_26.11.2025%20con%20omissis.pdf,2025,"Wed, 26 Nov 2025 00:00:00 +0000",2025-11-26
362,26/11/2025,"Atto di organizzazione di cui all’allegato I.9, articolo 1, comma 2, del decreto legislativo 31 marzo 2023, n. 36",infrastrutture e mobilita',,,,https://www2.regione.sicilia.it/deliberegiunta/file/giunta/allegati/N.362_26.11.2025.pdf,2025,"Wed, 26 Nov 2025 00:00:00 +0000",2025-11-26
361,26/11/2025,"Legge regionale 16 gennaio 2024, n.1, articolo 10. Iscrizione somme sui capitoli di spesa del bilancio regionale 313728 e 313005. Esercizio finanziario 2026","famiglia, politiche sociali e del lavoro",,,,https://www2.regione.sicilia.it/deliberegiunta/file/giunta/allegati/N.361_26.11.2025.pdf,2025,"Wed, 26 Nov 2025 00:00:00 +0000",2025-11-26
360,26/11/2025,"Articolo 3 della legge regionale 7 luglio 2020, n. 13. Proroga dello stato di crisi e di emergenza regionale per il sito della discarica di Mazzarrà Sant’Andrea – Contrada Zuppà, di cui alla deliberazione della Giunta regionale 11 novembre 2024 n. 343, e della nomina del Commissario delegato di cui alla deliberazione della Giunta regionale 19 novembre 2024, n. 386",energia e servizi di pubblica utilita',,,,https://www2.regione.sicilia.it/deliberegiunta/file/giunta/allegati/N.360_26.11.2025.pdf,2025,"Wed, 26 Nov 2025 00:00:00 +0000",2025-11-26
359,26/11/2025,"Avviso “Progetti di valore: investimenti per la crescita sostenibile dei Comuni Siciliani”, a valere sulle risorse del Fondo di spesa capitolo 653904 e del capitolo di spesa 652402 del bilancio regionale - Base giuridica. Apprezzamento",energia e servizi di pubblica utilita',,,,https://www2.regione.sicilia.it/deliberegiunta/file/giunta/allegati/N.359_26.11.2025.pdf,2025,"Wed, 26 Nov 2025 00:00:00 +0000",2025-11-26
358,26/11/2025,«Comune di San Salvatore di Fitalia (ME) “Lavori di sistemazione ingresso e accesso zona alservizio della Casa di Comunità”. Finanziamento a valere sulle risorse del capitolo 214920del bilancio della Regione Siciliana».,presidenza,,,,https://www2.regione.sicilia.it/deliberegiunta/file/giunta/allegati/N.358_26.11.2025.pdf,2025,"Wed, 26 Nov 2025 00:00:00 +0000",2025-11-26
357,26/11/2025,"Contributi ex articolo 128 della legge regionale 12 maggio 2010, n.11 e successive modifiche e integrazioni – Avviso pubblico approvato con decreto del Segretario generale della Presidenza della Regione 29 aprile 2025, n. 75 - Adempimenti",presidenza,,,,https://www2.regione.sicilia.it/deliberegiunta/file/giunta/allegati/N.357_26.11.2025.pdf,2025,"Wed, 26 Nov 2025 00:00:00 +0000",2025-11-26
356,26/11/2025,Programma Operativo Complementare Sicilia 2014/2020. Asse 2 &apos;Sostenere l’attuazione del green deal europeo&apos;. Azione 2.2.1 &apos;Interventi per la riduzione del rischio idrogeologico&apos;. Rimodulazione interventi di competenza del Commissario di Governo per il contrasto del dissesto idrogeologico nella Regione Siciliana,presidenza,,,,https://www2.regione.sicilia.it/deliberegiunta/file/giunta/allegati/N.356_26.11.2025.pdf,2025,"Wed, 26 Nov 2025 00:00:00 +0000",2025-11-26
355,20/11/2025,«Raddoppio ferroviario sulla linea ‘Messina-Catania’ - Apprezzamento»,infrastrutture e mobilita',,,,https://www2.regione.sicilia.it/deliberegiunta/file/giunta/allegati/N.355_20.11.2025.pdf,2025,"Thu, 20 Nov 2025 00:00:00 +0000",2025-11-20
354,20/11/2025,"«IRCCS Istituto Mediterraneo dei Trapianti e Terapie di Alta Specializzazione (ISMETT) diPalermo - Dichiarazione di interesse e contestuale richiesta di riconferma della qualifica di“Istituto di Ricovero e Cura a Carattere Scientifico”, ai sensi dell&apos;articolo 15 del decretolegislativo 16 ottobre 2003, n. 288, e successive modifiche e integrazioni per l&apos;area tematica diafferenza “Trapiantologia” – che comprende quella di “Cura e ricerca delle insufficienzeterminali d&apos;organo” – Rettifica deliberazione della Giunta regionale 14 ottobre 2025, n. 304»",salute,,,,https://www2.regione.sicilia.it/deliberegiunta/file/giunta/allegati/N.354_20.11.2025.pdf,2025,"Thu, 20 Nov 2025 00:00:00 +0000",2025-11-20
353,20/11/2025,"Spese per il pagamento dell’IRAP inerente la prosecuzione delle attività socialmente utili dei soggetti inseriti nell’elenco di cui all’articolo 30, comma 1, della legge regionale 28 gennaio 2014, n. 5. Richiesta iscrizione somme sul capitolo di spesa del bilancio regionale 313005, esercizio finanziario 2025 – Variazione compensativa dal capitolo del bilancio regionale 313728","famiglia, politiche sociali e del lavoro",,,,https://www2.regione.sicilia.it/deliberegiunta/file/giunta/allegati/N.353_20.11.2025.pdf,2025,"Thu, 20 Nov 2025 00:00:00 +0000",2025-11-20
352,20/11/2025,"Legge regionale 9 gennaio 2025, n. 1, articolo 10, comma 3. Iscrizione somme sul capitolo di spesa del bilancio regionale 313325. Esercizio finanziario 2026","famiglia, politiche sociali e del lavoro",,,,https://www2.regione.sicilia.it/deliberegiunta/file/giunta/allegati/N.352_20.11.2025.pdf,2025,"Thu, 20 Nov 2025 00:00:00 +0000",2025-11-20
351,20/11/2025,Comune di Capri Leone (ME) “Lavori per la riqualificazione del tessuto urbano delterritorio comunale”. Finanziamento a valere sulle risorse del capitolo 214920 delbilancio della Regione Siciliana,presidenza,,,,https://www2.regione.sicilia.it/deliberegiunta/file/giunta/allegati/N.351_20.11.2025.pdf.pdf,2025,"Thu, 20 Nov 2025 00:00:00 +0000",2025-11-20
350,20/11/2025,Dipartimento regionale del bilancio e del tesoro - Ragioneria generale della Regione - Assessorato regionale dell’economia - Incarico di Dirigente generale - Proroga tecnica,autonomie locali e funzione pubblica,Nomine,,,https://www2.regione.sicilia.it/deliberegiunta/file/giunta/allegati/N.350_20.11.2025.pdf,2025,"Thu, 20 Nov 2025 00:00:00 +0000",2025-11-20
349,20/11/2025,"Approvazione disegno di legge: &apos;Riconoscimento della legittimità dei debiti fuori bilancio ai sensi dell&apos;articolo 73, comma 1, lettera e) del decreto legislativo 23 giugno 2011, n. 118 e successive modifiche ed integrazioni. D.F.B. 2025. Mese di Ottobre&apos;",economia,,,1047,https://www2.regione.sicilia.it/deliberegiunta/file/giunta/allegati/N.349_20.11.2025_con%20omissis.pdf,2025,"Thu, 20 Nov 2025 00:00:00 +0000",2025-11-20
348,20/11/2025,"Approvazione disegno di legge: &apos;Riconoscimento della legittimità dei debiti fuori bilancio ai sensi dell&apos;articolo 73, comma 1, lettera a) del decreto legislativo 23 giugno 2011, n. 118 e successive modifiche ed integrazioni. D.F.B. 2025. Mese di Ottobre&apos;",economia,,,1046,https://www2.regione.sicilia.it/deliberegiunta/file/giunta/allegati/N.348_20.11.2025%20con%20omissis.pdf,2025,"Thu, 20 Nov 2025 00:00:00 +0000",2025-11-20
347,20/11/2025,Azioni per il rilancio delle attività dell&apos;Ufficio di rappresentanza della Regione Siciliana in Bruxelles. Integrazione,presidenza,,,,https://www2.regione.sicilia.it/deliberegiunta/file/giunta/allegati/N.347_20.2025.pdf,2025,"Thu, 20 Nov 2025 00:00:00 +0000",2025-11-20
346,20/11/2025,"Programmazione del Fondo per lo Sviluppo e la Coesione (FSC) 2021/2027. Accordo per la coesione della Regione Siciliana. Modifiche ai sensi del punto 2 della delibera CIPESS 9 luglio 2024, n. 41. Aggiornamento Allegato A",presidenza,,,,https://www2.regione.sicilia.it/deliberegiunta/file/giunta/allegati/N.346_20.11.2025.pdf,2025,"Thu, 20 Nov 2025 00:00:00 +0000",2025-11-20
345,20/11/2025,"Deliberazione della Giunta regionale 3 ottobre 2025, n. 279: ‘Fondo di rotazione ex legge 16 aprile 1987, n. 183 di cui all’articolo 1, comma 54, della legge 30 dicembre 2020, n. 178. Destinazione programmatica delle risorse’. Integrazione",presidenza,,,,https://www2.regione.sicilia.it/deliberegiunta/file/giunta/allegati/N.345_20.11.2025.pdf,2025,"Thu, 20 Nov 2025 00:00:00 +0000",2025-11-20
344,10/11/2025,Piano Energetico Ambientale della Regione Siciliana – P.E.A.R.S. Aggiornamento 2030,energia e servizi di pubblica utilita',,,,https://www2.regione.sicilia.it/deliberegiunta/file/giunta/allegati/N.344_10.11.2025.pdf,2025,"Mon, 10 Nov 2025 00:00:00 +0000",2025-11-10
343,10/11/2025,"Programmazione PR-FESR 2021-27. Proposta di modifica delle basi giuridiche relative alle seguenti azioni: 1.6.1. “ Promozione di investimenti per lo sviluppo e la fabbricazione delle tecnologie digitali, delle innovazioni, delle tecnologie deep tech e delle biotecnologie” – 2.9.1. “ Sostenere lo sviluppo e la fabbricazione di tecnologie pulite ed efficienti sotto il profilo delle risorse”",attivita' produttive,,,,https://www2.regione.sicilia.it/deliberegiunta/file/giunta/allegati/N.343_10.11.2025.pdf,2025,"Mon, 10 Nov 2025 00:00:00 +0000",2025-11-10
342,10/11/2025,"Articolo 3 della legge regionale 7 luglio 2020, n. 13. Proroga dello stato di crisi e di emergenza regionale di cui alla deliberazione della Giunta regionale 1 luglio 2025, n. 203 per l’evento del 10 dicembre 2024 in Caltanissetta, Via Redentore n. 39 e n. 20, Vicolo Scilla n. 29, Via Redentore n. 179, Via San Giovanni Bosco n. 65",presidenza,,,,https://www2.regione.sicilia.it/deliberegiunta/file/giunta/allegati/N.342_10.11.2025.pdf,2025,"Mon, 10 Nov 2025 00:00:00 +0000",2025-11-10
341,07/11/2025,"Deliberazione 7 novembre 2025, n. 341.«Consorzio di Bonifica 2 Palermo. Atto di indirizzo ed impulso della Giuntaregionale».",presidenza,,,,https://www2.regione.sicilia.it/deliberegiunta/file/giunta/allegati/N.341_07.11.2025%20con%20omissis_.pdf,2025,"Fri, 07 Nov 2025 00:00:00 +0000",2025-11-07
340,07/11/2025,"Dirigente generale del Dipartimento regionale della famiglia e delle politiche sociali dell’Assessorato regionale della famiglia, delle politiche sociali e del lavoro. Sospensione dell’incarico. Conferimento incarico di Dirigente generale del Dipartimento regionale della famiglia e delle politiche sociali ad interim al Dirigente generale pro-tempore del Dipartimento regionale del lavoro, dell’impiego, dell’orientamento, dei servizi e delle attività formative dell’Assessorato regionale della famiglia, delle politiche sociali e del lavoro",autonomie locali e funzione pubblica,,,,https://www2.regione.sicilia.it/deliberegiunta/file/giunta/allegati/N.340_07.11.2025%20con%20omissis.pdf,2025,"Fri, 07 Nov 2025 00:00:00 +0000",2025-11-07
339,07/11/2025,"Approvazione disegno di legge: &apos;Riconoscimento della legittimità dei debiti fuori bilancio ai sensi dell&apos;articolo 73, comma 1, lettera e) del decreto legislativo 23 giugno 2011, n. 118 e successive modifiche ed integrazioni. D.F.B. 2025. Mese di Settembre",economia,,,1035,https://www2.regione.sicilia.it/deliberegiunta/file/giunta/allegati/N.339_07.11.2025%20con%20omissis.pdf,2025,"Fri, 07 Nov 2025 00:00:00 +0000",2025-11-07
338,07/11/2025,"Approvazione disegno di legge: &apos;Riconoscimento della legittimità dei debiti fuoribilancio ai sensi dell&apos;articolo 73, comma 1, lettera a) del decreto legislativo 23 giugno2011, n. 118 e successive modifiche ed integrazioni. D.F.B. 2025. Mese diSettembre&apos;",economia,,,1034,https://www2.regione.sicilia.it/deliberegiunta/file/giunta/allegati/N.338_07.11.2025%20con%20omissis.pdf,2025,"Fri, 07 Nov 2025 00:00:00 +0000",2025-11-07
337,07/11/2025,"Piano d&apos;investimenti in materiale rotabile - 2014/2020 - 2021/2027 - 2028/2034. Deliberazione della Giunta regionale 11 marzo 2024, n. 96 – Modifiche e integrazioni - Apprezzamento",infrastrutture e mobilita',,,,https://www2.regione.sicilia.it/deliberegiunta/file/giunta/allegati/N.337_07.11.2025.pdf,2025,"Fri, 07 Nov 2025 00:00:00 +0000",2025-11-07
336,07/11/2025,Atto di indirizzo per la modifica e l&apos;integrazione della deliberazione della Giunta regionale n. 481 del 29 ottobre 2020 “Matrice dei Profili Professionali e Dizionario delle competenze [...]” e del relativo allegato avente a oggetto “Titolo di studio per l&apos;accesso dall&apos;esterno”. Apprezzamento,autonomie locali e funzione pubblica,,,,https://www2.regione.sicilia.it/deliberegiunta/file/giunta/allegati/N.336_07.11.2025.pdf,2025,"Fri, 07 Nov 2025 00:00:00 +0000",2025-11-07
335,31/10/2025,Approvazione disegno di legge: Legge di stabilità regionale 2026/2028,economia,,,,https://www2.regione.sicilia.it/deliberegiunta/file/giunta/allegati/N.335_31.10.2025.pdf,2025,"Fri, 31 Oct 2025 00:00:00 +0000",2025-10-31
334,31/10/2025,Approvazione disegno di legge: &apos;Bilancio di previsione della Regione Siciliana per il triennio 2026/2028,economia,,,,https://www2.regione.sicilia.it/deliberegiunta/file/giunta/allegati/N.334_31.10.2025.pdf,2025,"Fri, 31 Oct 2025 00:00:00 +0000",2025-10-31
333,31/10/2025,"Programmazione Fondo Sviluppo e Coesione FSC 2021- 2027 – Accordo per la Coesione Governo – Regione Siciliana di cui alla Delibera CIPESS n. 41/9.7.2024 – Riqualificazione del complesso termale di Sciacca ID 7F2A9778 – Approvazione base giuridica relativa all’avviso esplorativo ex articolo 193, comma 16, decreto legislativo n. 36/2023, come modificato dal decreto legislativo n. 209/2024, avente a oggetto la concessione per la progettazione, l’esecuzione dei lavori e la gestione del complesso termale di Sciacca (AG)",attivita' produttive,,,,https://www2.regione.sicilia.it/deliberegiunta/file/giunta/allegati/N.333_31.10.2025.pdf,2025,"Fri, 31 Oct 2025 00:00:00 +0000",2025-10-31
332,31/10/2025,Mandato al Dipartimento regionale della funzione pubblica e del personale per l’indizione di Atto d’interpello per il conferimento dell&apos;incarico di Segretario Generale della Presidenza della Regione,autonomie locali e funzione pubblica,,,,https://www2.regione.sicilia.it/deliberegiunta/file/giunta/allegati/N.332_31.10.2025.pdf,2025,"Fri, 31 Oct 2025 00:00:00 +0000",2025-10-31
331,31/10/2025,Fondo per le politiche della famiglia - Programmazione delle somme anno 2025,"famiglia, politiche sociali e del lavoro",,,,https://www2.regione.sicilia.it/deliberegiunta/file/giunta/allegati/N.331_31.10.2025.pdf,2025,"Fri, 31 Oct 2025 00:00:00 +0000",2025-10-31
330,31/10/2025,"Affidamento in concessione, senza esclusiva, dei servizi pubblici di trasporto marittimo regionale con compensazione finanziaria, mediante navi ‘ro-ro’ e unità veloci per la continuità territoriale marittima delle isole minori della Sicilia - Affidamento ponte - Apprezzamento",infrastrutture e mobilita',,,,https://www2.regione.sicilia.it/deliberegiunta/file/giunta/allegati/N.330_31.10.2025.pdf,2025,"Fri, 31 Oct 2025 00:00:00 +0000",2025-10-31
329,31/10/2025,Nota di Aggiornamento al Documento di Economia e Finanza Regionale (NADEFR) 2026/2028,economia,,,,https://www2.regione.sicilia.it/deliberegiunta/file/giunta/allegati/N.329_31.10.2025.pdf,2025,"Fri, 31 Oct 2025 00:00:00 +0000",2025-10-31
328,24/10/2025,"Revoca del decreto del Presidente della Regione 23 dicembre 2024, n. 702/Serv. 4/S.G., afferente l’autorizzazione alla costituzione di un diritto reale di godimento, sull&apos;ex Ospedale Civile di Ragusa, in favore del Comando Provinciale Carabinieri di Ragusa",salute,,,,https://www2.regione.sicilia.it/deliberegiunta/file/giunta/allegati/N.328_24.10.2025.pdf,2025,"Fri, 24 Oct 2025 00:00:00 +0000",2025-10-24
327,24/10/2025,"Assessorato regionale del turismo, dello sport e dello spettacolo - Dipartimento regionale del turismo, dello sport e dello spettacolo dell&apos;Assessorato regionale del turismo, dello sport e dello spettacolo - Incarico di Dirigente generale - Proroga tecnica",autonomie locali e funzione pubblica,,,,https://www2.regione.sicilia.it/deliberegiunta/file/giunta/allegati/N.327_24.10.2025.pdf,2025,"Fri, 24 Oct 2025 00:00:00 +0000",2025-10-24
326,24/10/2025,"Canoni Demaniali Marittimi. Adeguamento alla disciplina nazionale: aumento del canone demaniale marittimo di cui al decreto legge 14 agosto 2020, n. 104 e del canone minimo annuo di cui alla legge 5 agosto 2022, n. 118",territorio e ambiente,,,,https://www2.regione.sicilia.it/deliberegiunta/file/giunta/allegati/N.326_24.10.2025.pdf,2025,"Fri, 24 Oct 2025 00:00:00 +0000",2025-10-24
325,24/10/2025,"Richiesta di finanziamento per l’immobile vandalizzato di proprietà dell’Istituto Autonomo per le Case Popolari (I.A.C.P.) di Palermo, sito in Via Bronte, n.12, piano rialzato, lato sinistro. Apprezzamento",infrastrutture e mobilita',,,,https://www2.regione.sicilia.it/deliberegiunta/file/giunta/allegati/N.325_24.10.2025.pdf,2025,"Fri, 24 Oct 2025 00:00:00 +0000",2025-10-24
324,24/10/2025,"Iter di approvazione del Progetto Esecutivo delle Varianti al Progetto definitivo (WBS NI14, NI15, SI16 e FA27 asse Palermo-Catania-Messina, finanziato anche con fondi PNRR) ai sensi dell’articolo 4, comma 2 del decreto legge n. 32/2019 convertito, con modificazioni, dalla legge n. 55/2019 e successive modifiche e intagrazioni, nell’ambito del Primo Lotto Fiumefreddo-Taormina/Letojanni del Raddoppio ferroviario Tratta Giampilieri-Fiumefreddo - (CUP: J11H02000070008) - Presa d&apos;atto",infrastrutture e mobilita',,,,https://www2.regione.sicilia.it/deliberegiunta/file/giunta/allegati/N.324_24.10.2025.pdf,2025,"Fri, 24 Oct 2025 00:00:00 +0000",2025-10-24
323,24/10/2025,"Assessorato regionale della famiglia, delle politiche sociali e del lavoro -Dipartimento regionale del lavoro, dell’impiego, dell’orientamento, dei servizi e delleattività formative - Incarico di Dirigente generale - Proroga tecnica",autonomie locali e funzione pubblica,,,,https://www2.regione.sicilia.it/deliberegiunta/file/giunta/allegati/N.323_24.10.2025.pdf,2025,"Fri, 24 Oct 2025 00:00:00 +0000",2025-10-24
322,24/10/2025,«Accordo per la compensazione al settore della pesca nell&apos;ambito del progetto &apos;Argo - Cassiopea&apos; tra Regione Siciliana e Eni Mediterranea Idrocarburi S.p.A. - Approvazione elenchi dei beneficiari – Prima e seconda rata di indennità compensativa ad esito dei giudizi innanzi al Tribunale Amministrativo Regionale per la Sicilia e accantonamento saldo»,"agricoltura, sviluppo rurale e pesca mediterranea",,,,https://www2.regione.sicilia.it/deliberegiunta/file/giunta/allegati/N.322_24.10.2025%20con%20omissis.pdf,2025,"Fri, 24 Oct 2025 00:00:00 +0000",2025-10-24
321,24/10/2025,"Legge regionale 25 maggio 2022, n. 13, articolo 14, comma 2. ApprovazioneAppendice al Piano Assunzionale Servizi Ausiliari Sicilia (SAS) S.C.p.A. per l’anno2025",economia,,,,https://www2.regione.sicilia.it/deliberegiunta/file/giunta/allegati/N.321_24.10.2025.pdf,2025,"Fri, 24 Oct 2025 00:00:00 +0000",2025-10-24
320,24/10/2025,Ufficio Speciale Autorità di Audit dei programmi Cofinanziati dalla Commissione Europea della Presidenza della Regione - Incarico di Dirigente generale - Proroga tecnica,autonomie locali e funzione pubblica,Nomine,,,https://www2.regione.sicilia.it/deliberegiunta/file/giunta/allegati/N.320_24.10.2025.pdf,2025,"Fri, 24 Oct 2025 00:00:00 +0000",2025-10-24
319,24/10/2025,Deliberazione ritirata,presidenza,,,,https://www2.regione.sicilia.it/deliberegiunta/file/giunta/allegati/DELIBERAZIONE%20RITIRATA.pdf,2025,"Fri, 24 Oct 2025 00:00:00 +0000",2025-10-24
318,24/10/2025,Protocollo d&apos;intesa tra la Regione Siciliana e SVIMEZ Associazione per lo Sviluppo dell&apos;Industria nel Mezzogiorno,presidenza,,,,https://www2.regione.sicilia.it/deliberegiunta/file/giunta/allegati/N.318_24.10.2025.pdf,2025,"Fri, 24 Oct 2025 00:00:00 +0000",2025-10-24
317,24/10/2025,Proroga Commissario straordinario del Comitato direttivo dell&apos;Agenzia per la rappresentanza negoziale della Regione Siciliana (ARAN),presidenza,,,,https://www2.regione.sicilia.it/deliberegiunta/file/giunta/allegati/N.317_24.10.2025.pdf,2025,"Fri, 24 Oct 2025 00:00:00 +0000",2025-10-24
316,24/10/2025,"Piano di Azione e Coesione (PAC) Sicilia 2007/2013. Deliberazione della Giunta regionale 11 dicembre 2024, n. 416. Finalizzazione economie di competenza del Dipartimento regionale delle attività produttive",presidenza,,,,https://www2.regione.sicilia.it/deliberegiunta/file/giunta/allegati/N.316_24.10.2025.pdf,2025,"Fri, 24 Oct 2025 00:00:00 +0000",2025-10-24
315,24/10/2025,"Programma Operativo Complementare (P.O.C.) Sicilia 2014/2020. Asse 1 &quot;Sostenere la competitività e la trasformazione digitale, sostenibile e innovativa&quot;. Riprogrammazione delle risorse finanziarie del Dipartimento regionale del turismo, dello sport e dello spettacolo",presidenza,,,,https://www2.regione.sicilia.it/deliberegiunta/file/giunta/allegati/N.315_24.10.2025.pdf,2025,"Fri, 24 Oct 2025 00:00:00 +0000",2025-10-24
314,24/10/2025,"Programma Operativo Complementare (P.O.C.) Sicilia 2014/2020. Asse 1 &quot;Sostenere la competitività e la trasformazione digitale, sostenibile e innovativa&quot;. Riprogrammazione delle risorse finanziarie del Dipartimento regionale delle attività produttive",presidenza,,,,https://www2.regione.sicilia.it/deliberegiunta/file/giunta/allegati/N.314_24.10.2025.pdf,2025,"Fri, 24 Oct 2025 00:00:00 +0000",2025-10-24
313,24/10/2025,"Programma Nazionale di Assistenza tecnica Capacità per la Coesione 2021/2027 (CAPCOE). Priorità 1, Azione 1.1.2. Assunzione di personale a tempo indeterminato presso i principali beneficiari. Criteri per l&apos;assegnazione alle strutture dipartimentali delle 70 unità di personale sostenute nell’ambito del PN CAPCOE – Regione Siciliana",presidenza,,,,https://www2.regione.sicilia.it/deliberegiunta/file/giunta/allegati/N.313_24.10.2025.pdf,2025,"Fri, 24 Oct 2025 00:00:00 +0000",2025-10-24
312,24/10/2025,Osservatorio Nazionale dei Contratti di Fiume - Consulta delle Istituzioni - Designazione rappresentante,presidenza,Nomine,,,https://www2.regione.sicilia.it/deliberegiunta/file/giunta/allegati/N.312_24.10.2025_CON%20OMISSIS.pdf,2025,"Fri, 24 Oct 2025 00:00:00 +0000",2025-10-24
311,20/10/2025,"Accordo per la Coesione della Regione Siciliana. Programmazione FSC 2021/2027. Conferimento di funzioni di Organismo Intermedio alla Struttura del Commissario di Governo per il contrasto del dissesto idrogeologico nella Regione Siciliana per l’attuazione degli interventi di competenza dell’Autorità di Bacino del Distretto Idrografico della Sicilia, afferenti all’ambito d’intervento 05. &apos;Ambiente e risorse naturali&apos; – linea di intervento 05.01 &apos;Rischi e adattamento climatico&apos; e di un intervento afferente all’ambito di intervento 12. &apos;Capacità amministrativa&apos; – linea di intervento 12.02 &apos;Assistenza tecnica&apos;",presidenza,,,,https://www2.regione.sicilia.it/deliberegiunta/file/giunta/allegati/N.311_20.10.2025_con%20omissis.pdf,2025,"Mon, 20 Oct 2025 00:00:00 +0000",2025-10-20
310,20/10/2025,&apos;Piano Regionale di Gestione dei Rifiuti - Stralcio Rifiuti Speciali&apos;. Apprezzamento,energia e servizi di pubblica utilita',,,,https://www2.regione.sicilia.it/deliberegiunta/file/giunta/allegati/N.310_20.10.2025.pdf,2025,"Mon, 20 Oct 2025 00:00:00 +0000",2025-10-20
309,14/10/2025,Pesatura Ufficio speciale per la gestione e liquidazione delle società a partecipazione pubblica regionale dell’Assessorato regionale dell’economia per l’anno 2025. Articolo 72 del Contratto collettivo regionale di lavoro 2019-2021 del personale dell’Area della dirigenza – Anno 2025,economia,,,,https://www2.regione.sicilia.it/deliberegiunta/file/giunta/allegati/N.309_14.10.2025.pdf,2025,"Tue, 14 Oct 2025 00:00:00 +0000",2025-10-14
308,14/10/2025,«Programma regionale FSE+ 2021/2027. Riprogrammazione in applicazione delRegolamento (UE) 1913/2025 del Parlamento Europeo e del Consiglio del 18 settembre 2025recante &quot;Modifica del Regolamento (UE) 2021/1057 che istituisce il Fondo Sociale EuropeoPlus&quot;». Apprezzamento.,istruzione e formazione professionale,,,,https://www2.regione.sicilia.it/deliberegiunta/file/giunta/allegati/N.308_14.10.2025.pdf,2025,"Tue, 14 Oct 2025 00:00:00 +0000",2025-10-14
307,14/10/2025,Fondo per lo Sviluppo e la Coesione (FSC) 2021/2027. Contributi a sostegno degli interventi dell’impiantistica sportiva – Area tematica 10. Sociale e Salute - Linea di intervento 10.1 Strutture Sociali di cui alla Delibera CIPESS 41/2024. Individuazione soggetto per attività di supporto tecnico-amministrativo,"turismo, sport e spettacolo",,,,https://www2.regione.sicilia.it/deliberegiunta/file/giunta/allegati/N.307_14.10.2025_con%20omissis.pdf,2025,"Tue, 14 Oct 2025 00:00:00 +0000",2025-10-14
306,14/10/2025,"Intesa, ai sensi dell’articolo 8, comma 6, della legge 5 giugno 2003, n. 131, tra il Governo, le Regioni e le Province autonome di Trento e Bolzano su obiettivi e finalità degli accordi di programma, in attuazione delle disposizioni dell’articolo 43 “Residenze” del decreto del Ministro dei beni e delle attività culturali e del turismo n. 332 del 27 luglio 2017 e ss.mm. - Attivazione del fondo di cofinanziamento articolo 88 legge regionale 26 marzo 2002, n. 2 - Integrazione","turismo, sport e spettacolo",,,,https://www2.regione.sicilia.it/deliberegiunta/file/giunta/allegati/N.306_14.10.2025.pdf,2025,"Tue, 14 Oct 2025 00:00:00 +0000",2025-10-14
305,14/10/2025,"Istituto Sperimentale Zootecnico per la Sicilia (I.S.Z.S.) – Delibera Commissario straordinario 5 settembre 2025, n. 29 &apos;Riapprovazione nuova pianta organica e Piano triennale dei fabbisogni di personale – art. 6, commi 2 e 3 del d.lgs. 165/2001&apos;","agricoltura, sviluppo rurale e pesca mediterranea",,,,https://www2.regione.sicilia.it/deliberegiunta/file/giunta/allegati/N.305_14.10.2025%20con%20omissis.pdf,2025,"Tue, 14 Oct 2025 00:00:00 +0000",2025-10-14
304,14/10/2025,Istituto di ricovero e cura a carattere scientifico (IRCCS) - Istituto mediterraneo per i trapianti e le terapie di alta specializzazione (ISMETT) di Palermo - Dichiarazione di interesse e contestuale richiesta di riconferma della qualifica di IRCCS per l&apos;area &apos;Cura e ricerca delle insufficienze terminali d&apos;organo&apos; - Apprezzamento,salute,,,,https://www2.regione.sicilia.it/deliberegiunta/file/giunta/allegati/N.304_14.10.2025.pdf,2025,"Tue, 14 Oct 2025 00:00:00 +0000",2025-10-14
303,14/10/2025,Istituto di ricovero e cura a carattere scientifico (IRCCS) - Centro Neurolesi &apos;Bonino Pulejo&apos; di Messina - Dichiarazione di interesse e contestuale richiesta di riconferma della qualifica di IRCCS per l&apos;area &apos;Riabilitazione&apos; - Apprezzamento,salute,,,,https://www2.regione.sicilia.it/deliberegiunta/file/giunta/allegati/N.303_14.10.2025.pdf,2025,"Tue, 14 Oct 2025 00:00:00 +0000",2025-10-14
302,14/10/2025,"Articolo 3 della legge regionale 7 luglio 2020 n.13. Proroga dello stato di crisi e di emergenza regionale di cui alla deliberazione della Giunta regionale 1 aprile 2025 n. 98. Interruzione della via Garipoli di accesso ai comuni di Taormina e Castelmola, in provincia di Messina a seguito di dissesto idreogeologico",presidenza,,,,https://www2.regione.sicilia.it/deliberegiunta/file/giunta/allegati/N.302_14.10.2025.pdf,2025,"Tue, 14 Oct 2025 00:00:00 +0000",2025-10-14
301,03/10/2025,Approvazione verbale n. 14 relativo alla seduta della Giunta regionale del 29 aprile 2025,presidenza,,,,https://www2.regione.sicilia.it/deliberegiunta/file/giunta/allegati/N.301_03.10.2025.pdf,2025,"Fri, 03 Oct 2025 00:00:00 +0000",2025-10-03
300,03/10/2025,Approvazione verbale n. 13 relativo alla seduta della Giunta regionale del 24 aprile 2025,presidenza,,,,https://www2.regione.sicilia.it/deliberegiunta/file/giunta/allegati/N.300_03.10.2025.pdf,2025,"Fri, 03 Oct 2025 00:00:00 +0000",2025-10-03
299,03/10/2025,Approvazione verbale n. 12 relativo alla seduta della Giunta regionale del 14 aprile 2025,presidenza,,,,https://www2.regione.sicilia.it/deliberegiunta/file/giunta/allegati/N.299_03.10.2025.pdf,2025,"Fri, 03 Oct 2025 00:00:00 +0000",2025-10-03
298,03/10/2025,Approvazione verbale n. 11 relativo alla seduta della Giunta regionale dell&apos;1 aprile 2025,presidenza,,,,https://www2.regione.sicilia.it/deliberegiunta/file/giunta/allegati/N.298_03.10.2025.pdf,2025,"Fri, 03 Oct 2025 00:00:00 +0000",2025-10-03
297,03/10/2025,Approvazione verbale n. 10 relativo alla seduta della Giunta regionale del 19 marzo 2025,presidenza,,,,https://www2.regione.sicilia.it/deliberegiunta/file/giunta/allegati/N.297_03.10.2025.pdf,2025,"Fri, 03 Oct 2025 00:00:00 +0000",2025-10-03
296,03/10/2025,Approvazione verbale n. 9 relativo alla seduta della Giunta regionale del 14 marzo 2025,presidenza,,,,https://www2.regione.sicilia.it/deliberegiunta/file/giunta/allegati/N.296_03.10.2025.pdf,2025,"Fri, 03 Oct 2025 00:00:00 +0000",2025-10-03
295,03/10/2025,Approvazione verbale n. 8 relativo alla seduta della Giunta regionale del 27 febbraio 2025,presidenza,,,,https://www2.regione.sicilia.it/deliberegiunta/file/giunta/allegati/N.295_03.10.2025.pdf,2025,"Fri, 03 Oct 2025 00:00:00 +0000",2025-10-03
294,03/10/2025,Approvazione verbale n. 7 relativo alla seduta della Giunta regionale del 18 febbraio 2025,presidenza,,,,https://www2.regione.sicilia.it/deliberegiunta/file/giunta/allegati/N.294_03.10.2025.pdf,2025,"Fri, 03 Oct 2025 00:00:00 +0000",2025-10-03
293,03/10/2025,Approvazione verbale n. 6 relativo alla seduta della Giunta regionale del 14 febbraio 2025,presidenza,,,,https://www2.regione.sicilia.it/deliberegiunta/file/giunta/allegati/N.293_03.10.2025.pdf,2025,"Fri, 03 Oct 2025 00:00:00 +0000",2025-10-03
292,03/10/2025,Approvazione verbale n. 5 relativo alla seduta della Giunta regionale del 4 febbraio 2025,presidenza,,,,https://www2.regione.sicilia.it/deliberegiunta/file/giunta/allegati/N.292_03.10.2025.pdf,2025,"Fri, 03 Oct 2025 00:00:00 +0000",2025-10-03
291,03/10/2025,Approvazione verbale n. 4 relativo alla seduta della Giunta regionale del 30 gennaio2025,presidenza,,,,https://www2.regione.sicilia.it/deliberegiunta/file/giunta/allegati/N.291_03.10.2025.pdf,2025,"Fri, 03 Oct 2025 00:00:00 +0000",2025-10-03
290,03/10/2025,Approvazione verbale n. 3 relativo alla seduta della Giunta regionale del 23 gennaio2025,presidenza,,,,https://www2.regione.sicilia.it/deliberegiunta/file/giunta/allegati/N.290_03.10.2025.pdf,2025,"Fri, 03 Oct 2025 00:00:00 +0000",2025-10-03
289,03/10/2025,Approvazione verbale n. 2 relativo alla seduta della Giunta regionale del 16 gennaio2025,presidenza,,,,https://www2.regione.sicilia.it/deliberegiunta/file/giunta/allegati/N.289_03.10.2025.pdf,2025,"Fri, 03 Oct 2025 00:00:00 +0000",2025-10-03
288,03/10/2025,Approvazione verbale n. 1 relativo alla seduta della Giunta regionale del 10 gennaio2025,presidenza,,,,https://www2.regione.sicilia.it/deliberegiunta/file/giunta/allegati/N.288_03.10.2025.pdf,2025,"Fri, 03 Oct 2025 00:00:00 +0000",2025-10-03
287,03/10/2025,Incarico di Dirigente generale del Dipartimento regionale per la pianificazione strategica dell’Assessorato regionale della salute al dott. Salvatore Iacolino,autonomie locali e funzione pubblica,Nomine,,,https://www2.regione.sicilia.it/deliberegiunta/file/giunta/allegati/N.287_03.10.2025%20con%20omissis.pdf,2025,"Fri, 03 Oct 2025 00:00:00 +0000",2025-10-03
286,03/10/2025,Piano di ripartizione dei finanziamenti da assegnare agli Enti gestori delle Scuole di servizio sociale per l&apos;anno accademico 2024/2025 - Esercizio finanziario 2025 - L.r. n 200/1979 - Approvazione,istruzione e formazione professionale,,,,https://www2.regione.sicilia.it/deliberegiunta/file/giunta/allegati/N.286_3.10.2025.pdf,2025,"Fri, 03 Oct 2025 00:00:00 +0000",2025-10-03
285,03/10/2025,"Presidenza del Consiglio dei Ministri, Dipartimento per le politiche della famiglia - Avviso pubblico per l&apos;acquisizione della manifestazione di interesse, da parte delle Regioni, a partecipare all&apos;iniziativa sperimentale sul &apos;Rafforzamento della rete dei Centri per la famiglia&apos;. Autorizzazione","famiglia, politiche sociali e del lavoro",,,,https://www2.regione.sicilia.it/deliberegiunta/file/giunta/allegati/N.285_03.10.2025.pdf,2025,"Fri, 03 Oct 2025 00:00:00 +0000",2025-10-03
284,03/10/2025,"Legge regionale 9 gennaio 2025, n. 1, articolo 10, comma 3. Iscrizione somme sul capitolo di spesa del bilancio regionale n. 313325. Esercizio finanziario 2025","famiglia, politiche sociali e del lavoro",,,,https://www2.regione.sicilia.it/deliberegiunta/file/giunta/allegati/N.284_03.10.2025.pdf,2025,"Fri, 03 Oct 2025 00:00:00 +0000",2025-10-03
283,03/10/2025,Programma Regionale FESR Sicilia 2021/2027. Azione 1.3.3 &apos;Sostegno alle PMI per la crescita sui mercati internazionali&apos;. Modifica della Base giuridica del regime di aiuti &apos;de minimis&apos; relativa ad attività di internazionalizzazione,attivita' produttive,,,,https://www2.regione.sicilia.it/deliberegiunta/file/giunta/allegati/N.283_03.10.2025.pdf,2025,"Fri, 03 Oct 2025 00:00:00 +0000",2025-10-03
282,03/10/2025,"Ente di Sviluppo Agricolo – Delibera commissariale 30 maggio 2025, n. 26 recante &apos;Approvazione Bilancio di previsione finanziario per il triennio 2025/2027&apos;","agricoltura, sviluppo rurale e pesca mediterranea",,,,https://www2.regione.sicilia.it/deliberegiunta/file/giunta/allegati/N.282_03.10.2025_con%20omissis.pdf,2025,"Fri, 03 Oct 2025 00:00:00 +0000",2025-10-03
281,03/10/2025,"Autorizzazione per la costituzione parte civile della Presidenza della Regione Siciliana e, segnatamente, dell&apos;Assessorato regionale dell&apos;agricoltura, dello sviluppo rurale e della pesca mediterranea, nel procedimento penale n. XXXXXXXX a carico di XXXXXXXX XXXXXXXX pendente presso il Tribunale di XXXXXXX",presidenza,,,,https://www2.regione.sicilia.it/deliberegiunta/file/giunta/allegati/N.281_03.10.2025%20con%20omissis.pdf,2025,"Fri, 03 Oct 2025 00:00:00 +0000",2025-10-03
280,03/10/2025,"Autorizzazione per la costituzione parte civile della Presidenza della Regione Siciliana e, segnatamente, dell&apos;Assessorato regionale dell&apos;agricoltura, dello sviluppo rurale e delle pesca mediterranea, nel procedimento penale n. XXXXXX, a carico di XXXXXXX, pendente presso il Tribunale di XXXXXX",presidenza,,,,https://www2.regione.sicilia.it/deliberegiunta/file/giunta/allegati/N.280_03.10.2025_con%20omissis.pdf,2025,"Fri, 03 Oct 2025 00:00:00 +0000",2025-10-03
279,03/10/2025,"Fondo di rotazione ex legge 16 aprile 1987, n. 183 di cui all’articolo 1, comma 54, della legge 30 dicembre 2020, n. 178. Destinazione programmatica delle risorse",presidenza,,Spesa,,https://www2.regione.sicilia.it/deliberegiunta/file/giunta/allegati/N.279_03.10.2025.pdf,2025,"Fri, 03 Oct 2025 00:00:00 +0000",2025-10-03
278,03/10/2025,Programma Regionale FESR Sicilia 2021/2027. Riprogrammazione in applicazione delle modifiche al Regolamento (UE) 2021/1058 apportate con Regolamento (UE) 2025/1914 del 18 settembre 2025 (Riprogrammazione Mid-Term Review),presidenza,,,,https://www2.regione.sicilia.it/deliberegiunta/file/giunta/allegati/N.278_03.10.2025.pdf,2025,"Fri, 03 Oct 2025 00:00:00 +0000",2025-10-03
277,03/10/2025,Organismo indipendente di valutazione (OIV) della Regione Siciliana in forma collegiale - Nomina Presidente,presidenza,,,,https://www2.regione.sicilia.it/deliberegiunta/file/giunta/allegati/N.277_03.10.2025%20con%20omissis.pdf,2025,"Fri, 03 Oct 2025 00:00:00 +0000",2025-10-03
276,24/09/2025,Revisione della rete ospedaliera della Regione Siciliana - Approvazione,salute,,,,https://www2.regione.sicilia.it/deliberegiunta/file/giunta/allegati/N.276_24.09.2025.pdf,2025,"Wed, 24 Sep 2025 00:00:00 +0000",2025-09-24
275,24/09/2025,"Rendiconto generale della Regione Siciliana per l&apos;esercizio finanziario 2024. Decreto legislativo 23 giugno 2011, n. 118 e successive modifiche ed integrazioni",economia,,,,https://www2.regione.sicilia.it/deliberegiunta/file/giunta/allegati/N.275_24.09.2025.pdf,2025,"Wed, 24 Sep 2025 00:00:00 +0000",2025-09-24
274,24/09/2025,"Modifiche e integrazioni al riaccertamento ordinario dei residui attivi e passivi al 31 dicembre 2024 approvato con deliberazione della Giunta regionale 8 agosto 2025, n.240, ai sensi dell&apos;articolo 3, comma 4, del decreto legislativo 23 giugno 2011, n. 118 e successive modifiche ed integrazioni",economia,,,,https://www2.regione.sicilia.it/deliberegiunta/file/giunta/allegati/N.274_24.09.2025.pdf,2025,"Wed, 24 Sep 2025 00:00:00 +0000",2025-09-24
273,24/09/2025,Incarico di Dirigente generale del Dipartimento regionale del bilancio e del tesoro - Ragioneria generale della Regione dell’Assessorato regionale dell’economia - Proroga tecnica,autonomie locali e funzione pubblica,,,,https://www2.regione.sicilia.it/deliberegiunta/file/giunta/allegati/N.273_24.09.2025.pdf,2025,"Wed, 24 Sep 2025 00:00:00 +0000",2025-09-24
272,24/09/2025,"Approvazione disegno di legge: &apos;Riconoscimento della legittimità dei debiti fuori bilancio ai sensi dell&apos;articolo 73, comma 1, lettera e) del decreto legislativo 23 giugno 2011, n. 118 e successive modifiche ed integrazioni. D.F.B. 2025. Mese di Agosto&apos;",economia,,,1007,https://www2.regione.sicilia.it/deliberegiunta/file/giunta/allegati/N.272_24.09.2025%20con%20omissis.pdf,2025,"Wed, 24 Sep 2025 00:00:00 +0000",2025-09-24
271,19/09/2025,"Approvazione disegno di legge: &apos;Riconoscimento della legittimità dei debiti fuori bilancio ai sensi dell&apos;articolo 73, comma 1, lettera a) del decreto legislativo 23 giugno 2011, n. 118 e successive modifiche ed integrazioni. D.F.B. 2025. Mese di Agosto&apos;",economia,,,1004,https://www2.regione.sicilia.it/deliberegiunta/file/giunta/allegati/N.271_19.09.2025%20con%20omissis.pdf,2025,"Fri, 19 Sep 2025 00:00:00 +0000",2025-09-19
270,19/09/2025,"Copertura della postazione dirigenziale – Servizio 1 - ‘Autorizzazioni e valutazioni ambientali’ vacante presso il Dipartimento regionale dell’ambiente dell&apos;Assessorato regionale del territorio e dell’ambiente - Conferimento di incarico dirigenziale, ai sensi dell&apos;articolo 19, comma 6, del decreto legislativo 30 marzo 2001, n. 165 e successive modifiche e integrazioni",territorio e ambiente,,,,https://www2.regione.sicilia.it/deliberegiunta/file/giunta/allegati/N.270_19.09.2025.pdf,2025,"Fri, 19 Sep 2025 00:00:00 +0000",2025-09-19
269,19/09/2025,"Prestito d&apos;onore per gli studenti universitari. Legge regionale 18 novembre 2024, n. 28 e ss.mm.ii., articolo 20, comma 10, bozza di decreto interassessoriale. Apprezzamento.",istruzione e formazione professionale,,,,https://www2.regione.sicilia.it/deliberegiunta/file/giunta/allegati/N.269_19.09.2025.pdf,2025,"Fri, 19 Sep 2025 00:00:00 +0000",2025-09-19
268,19/09/2025,"Presentazione della candidatura regionale all&apos;Avviso pubblico approvato con decreto dipartimentale del Ministero dell&apos;istruzione e del merito n. 1282 del 3 giugno 2025, finalizzato al finanziamento della progettazione di fattibilità tecnico-economica per la realizzazione di campus della filiera formativa tecnologico-professionale. Apprezzamento",istruzione e formazione professionale,,,,https://www2.regione.sicilia.it/deliberegiunta/file/giunta/allegati/N.268_19.09.2025.pdf,2025,"Fri, 19 Sep 2025 00:00:00 +0000",2025-09-19
267,19/09/2025,"Legge regionale 9 gennaio 2025, n. 1, articolo 17. Cessione di azioni societarie della Società Servizi Ausiliari Sicilia S.C.p.a. (SAS) possedute dalla Regione Siciliana. Decreto legislativo 19 agosto 2016, n. 175, articolo 10, comma 1",economia,,,,https://www2.regione.sicilia.it/deliberegiunta/file/giunta/allegati/N.267_19.09.2025.pdf,2025,"Fri, 19 Sep 2025 00:00:00 +0000",2025-09-19
266,19/09/2025,"Approvazione disegno di legge: &apos;Riconoscimento della legittimità dei debiti fuori bilancio ai sensi dell&apos;articolo 73, comma 1, lettera e) del decreto legislativo 23 giugno 2011, n. 118 e successive modifiche ed integrazioni. D.F.B. 2025. Mese di Luglio&apos;",economia,,,1003,https://www2.regione.sicilia.it/deliberegiunta/file/giunta/allegati/N.266_19.09.2025_con%20omissis.pdf,2025,"Fri, 19 Sep 2025 00:00:00 +0000",2025-09-19
265,19/09/2025,"Approvazione disegno di legge: &apos;Riconoscimento della legittimità dei debiti fuori bilancio ai sensi dell&apos;articolo 73, comma 1, lettera a) del decreto legislativo 23 giugno 2011, n. 118 e successive modifiche ed integrazioni. D.F.B. 2025. Mese di Luglio&apos;",economia,,,1002,https://www2.regione.sicilia.it/deliberegiunta/file/giunta/allegati/N.265_19.09.2025%20con%20omissis.pdf,2025,"Fri, 19 Sep 2025 00:00:00 +0000",2025-09-19
264,19/09/2025,Programmazione Fondo Sviluppo e Coesione (FSC) 2021/2027 - Accordo per Coesione della Regione Siciliana. Linea di azione “Infrastrutture per le imprese”- Modifica interventi da realizzare dall&apos;IRSAP con cronoprogramma di spesa invariati,attivita' produttive,,Spesa,,https://www2.regione.sicilia.it/deliberegiunta/file/giunta/allegati/N.264_19.09.2025_con%20omissis.pdf,2025,"Fri, 19 Sep 2025 00:00:00 +0000",2025-09-19
263,19/09/2025,Politiche territoriali della Regione Siciliana per il periodo di programmazione 2021/2027. Aree Interne &apos;Mussomeli - Val dei Sicani&apos; e &apos;Calatino&apos;. Proroga dei termini per le attività di selezione delle operazioni,presidenza,,,,https://www2.regione.sicilia.it/deliberegiunta/file/giunta/allegati/N.263_19.09.2025.pdf,2025,"Fri, 19 Sep 2025 00:00:00 +0000",2025-09-19
262,12/09/2025,"Applicazione al personale del Centro per la Formazione Professionale e l’aggiornamento del Personale del Servizio Sanitario (CEFPAS) del CCRL del comparto non dirigenziale della Regione Siciliana e degli Enti di cui all’articolo 1 della legge regionale 15 maggio 2000, n. 10 - Tabella di equiparazione - Parere",salute,,,,https://www2.regione.sicilia.it/deliberegiunta/file/giunta/allegati/N.262_12.09.2025.pdf,2025,"Fri, 12 Sep 2025 00:00:00 +0000",2025-09-12
261,12/09/2025,"Piano Integrato di Attività e Organizzazione (PIAO) della Regione Siciliana 2025-2027. Piano triennale dei fabbisogni di personale del Comando del Corpo Forestale della Regione Siciliana. Modifica sez. 3.3.4.4 &quot;Scelte operative&quot;, in ottemperanza alla deliberazione della Giunta regionale 8 agosto 2025, n. 244. Approvazione",presidenza,,,,https://www2.regione.sicilia.it/deliberegiunta/file/giunta/allegati/N.261_12.09.2025.pdf,2025,"Fri, 12 Sep 2025 00:00:00 +0000",2025-09-12
260,12/09/2025,Mandato al Dipartimento regionale della funzione pubblica e del personale per l’indizione di Atto d’interpello per il conferimento dell&apos;incarico di Dirigente generale dell&apos;Ufficio Autorità di audit dei programmi cofinanziati dalla Commissione europea della Presidenza della Regione,autonomie locali e funzione pubblica,,,,https://www2.regione.sicilia.it/deliberegiunta/file/giunta/allegati/N.260_12.09.2025.pdf,2025,"Fri, 12 Sep 2025 00:00:00 +0000",2025-09-12
259,12/09/2025,"Autorizzazione per la costituzione parte civile della Presidenza della Regione Siciliana e, segnatamente, dell&apos;Assessorato regionale del territorio e dell&apos;ambiente, nel procedimento XXXXXXXXXX",presidenza,,,,https://www2.regione.sicilia.it/deliberegiunta/file/giunta/allegati/N.259_12.09.2025%20con%20omisis.pdf,2025,"Fri, 12 Sep 2025 00:00:00 +0000",2025-09-12
258,10/09/2025,"Specificazione delle competenze degli Uffici speciali istituiti ex articolo 4, comma 7, della legge regionale 15 maggio 2000, n. 10",economia,,,,https://www2.regione.sicilia.it/deliberegiunta/file/giunta/allegati/N.258_10.09.2025%20con%20omissis.pdf,2025,"Wed, 10 Sep 2025 00:00:00 +0000",2025-09-10
257,08/09/2025,"Schema Decreto Presidenziale - Istituzione dell&apos;elenco di soggetti idonei a far parte del Collegio consultivo tecnico (CCT), ex articolo 215, decreto legislativo 31 marzo 2023, n. 36, per le opere di interesse regionale e adozione delle linee guida per l’omogenea applicazione da parte delle stazioni appaltanti delle funzioni del Collegio consultivo tecnico nella Regione Siciliana - Modifica delibera 8 agosto 2025, n. 242",infrastrutture e mobilita',,,,https://www2.regione.sicilia.it/deliberegiunta/file/giunta/allegati/N.257_08.09.2025.pdf,2025,"Mon, 08 Sep 2025 00:00:00 +0000",2025-09-08
256,08/09/2025,Avviso per la realizzazione in Sicilia di Sistemi di video sorveglianza urbana di cui all’articolo 6 della legge regionale n. 29/2025 e Avviso per la realizzazione in Sicilia di Sistemi di manutenzione straordinaria di strade provinciali di cui all’articolo 7 della legge n. 29/2025 – Apprezzamento,infrastrutture e mobilita',,,,https://www2.regione.sicilia.it/deliberegiunta/file/giunta/allegati/N.256_08.09.2025.pdf,2025,"Mon, 08 Sep 2025 00:00:00 +0000",2025-09-08
255,04/09/2025,PR FSE + 2021-2027 - Piano di azione. Priorità 5 del PR FSE + Sicilia 2021 2027 - Apprezzamento,istruzione e formazione professionale,,,,https://www2.regione.sicilia.it/deliberegiunta/file/giunta/allegati/N.255_04.09.2025..pdf,2025,"Thu, 04 Sep 2025 00:00:00 +0000",2025-09-04
254,04/09/2025,Consorzio A.S.I. di Enna in liquidazione coatta amministrativa - Nomina Commissario liquidatore,economia,Nomine,,,https://www2.regione.sicilia.it/deliberegiunta/file/giunta/allegati/N.254_04.09.2025%20con%20omissis.pdf,2025,"Thu, 04 Sep 2025 00:00:00 +0000",2025-09-04
253,04/09/2025,Conferimento incarico di Dirigente generale del Dipartimento regionale dell’energia dell’Assessorato regionale dell’energia e dei servizi di pubblica utilità al dott. Carmelo Frittitta,energia e servizi di pubblica utilita',,,,https://www2.regione.sicilia.it/deliberegiunta/file/giunta/allegati/N.253_04.09.2025%20con%20omissis.pdf,2025,"Thu, 04 Sep 2025 00:00:00 +0000",2025-09-04
252,04/09/2025,"Schema di Regolamento recante norme di attuazione dell’articolo 2, commi 3 e 4, della legge regionale 21 maggio 2019, n. 7, per l’individuazione dei termini di conclusione dei procedimenti amministrativi di competenza del Comando del Corpo Forestale della Regione Siciliana – Rettifica allegati",territorio e ambiente,,,,https://www2.regione.sicilia.it/deliberegiunta/file/giunta/allegati/N.252_04.09.2025.pdf,2025,"Thu, 04 Sep 2025 00:00:00 +0000",2025-09-04
251,04/09/2025,"Programma straordinario di investimenti - Articolo 20 della legge 11 marzo 1988, n. 67 - Riprogrammazione",salute,,Spesa,,https://www2.regione.sicilia.it/deliberegiunta/file/giunta/allegati/N.251_04.09.2025.pdf,2025,"Thu, 04 Sep 2025 00:00:00 +0000",2025-09-04
250,04/09/2025,"Approvazione disegno di legge: &apos;Riconoscimento della legittimità dei debiti fuori bilancio ai sensi dell&apos;articolo 73, comma 1, lettera e) del decreto legislativo 23 giugno 2011, n. 118 e successive modifiche ed integrazioni. D.F.B. 2025. Mese di Giugno&apos;",economia,,,993,https://www2.regione.sicilia.it/deliberegiunta/file/giunta/allegati/N.250_04.09.2025%20con%20omissis_.pdf,2025,"Thu, 04 Sep 2025 00:00:00 +0000",2025-09-04
249,04/09/2025,"Approvazione disegno di legge: &apos;Riconoscimento della legittimità dei debiti fuori bilancio ai sensi dell&apos;articolo 73, comma 1, lettera a del decreto legislativo 23 giugno 2011, n. 118 e successive modifiche ed integrazioni. D.F.B. 2025. Mese di Giugno",economia,,,992,https://www2.regione.sicilia.it/deliberegiunta/file/giunta/allegati/N.249_04.09.202%20con%20omissis.pdf,2025,"Thu, 04 Sep 2025 00:00:00 +0000",2025-09-04
248,04/09/2025,Convenzione tra la Regione Siciliana e la Società Terna S.p.A. per la realizzazione ed esercizio dell’intervento ‘Interconnessione Italia - Tunisia’ e relative misure di compensazione e riequilibrio ambientale. Apprezzamento,beni culturali e dell'identita' siciliana,,,,https://www2.regione.sicilia.it/deliberegiunta/file/giunta/allegati/N.248_04.09.2025.pdf,2025,"Thu, 04 Sep 2025 00:00:00 +0000",2025-09-04
247,04/09/2025,Ente di Sviluppo Agricolo – Deliberazione n. 45/C.S. del 26 giugno 2025 Approvazione Rendiconto generale 2024,"agricoltura, sviluppo rurale e pesca mediterranea",,,,https://www2.regione.sicilia.it/deliberegiunta/file/giunta/allegati/N.247_04.09.2025.pdf,2025,"Thu, 04 Sep 2025 00:00:00 +0000",2025-09-04
246,04/09/2025,"Istituto Incremento Ippico per la Sicilia – Delibera Commissario Straordinario 16 giugno 2025, n. 13 “Modifiche nuovo Statuto - Espressione parere vincolante ex art.3, ultimo comma, della legge regionale 10 aprile 1978, n.2”","agricoltura, sviluppo rurale e pesca mediterranea",,,,https://www2.regione.sicilia.it/deliberegiunta/file/giunta/allegati/N.246_04.09.2025.pdf,2025,"Thu, 04 Sep 2025 00:00:00 +0000",2025-09-04
245,04/09/2025,"Articolo 3 della legge regionale 7 luglio 2020, n. 13. Proroga dello stato di crisi e di emergenza regionale e della nomina del Commissario delegato. Esplosione di una palazzina ubicata nel quartiere di San Giovanni Galermo in Catania, avvenuta il 21 gennaio 2025 per una fuga di gas",presidenza,,,,https://www2.regione.sicilia.it/deliberegiunta/file/giunta/allegati/N.245_04.09.2025.pdf,2025,"Thu, 04 Sep 2025 00:00:00 +0000",2025-09-04
244,08/08/2025,Piano Integrato di Attività e Organizzazione (PIAO) della Regione Siciliana 2025-2027. Comando del Corpo forestale della Regione Siciliana - Procedure assunzionali,territorio e ambiente,,,,https://www2.regione.sicilia.it/deliberegiunta/file/giunta/allegati/N.244_08.08.2025.pdf,2025,"Fri, 08 Aug 2025 00:00:00 +0000",2025-08-08
243,08/08/2025,"Schema di Regolamento recante norme di attuazione dell’articolo 2, commi 3 e 4, della legge regionale 21 maggio 2019, n. 7, per l’individuazione dei termini di conclusione dei procedimenti amministrativi di competenza del Comando del Corpo Forestale della Regione Siciliana - Approvazione",territorio e ambiente,,,,https://www2.regione.sicilia.it/deliberegiunta/file/giunta/allegati/N.243_08.08.2025.pdf,2025,"Fri, 08 Aug 2025 00:00:00 +0000",2025-08-08
242,08/08/2025,"Schema Decreto Presidenziale - Istituzione dell&apos;elenco di soggetti idonei a far parte del Collegio consultivo tecnico (CCT), ex articolo 215, decreto legislativo 31 marzo 2023, n. 36, per le opere di interesse regionale e adozione delle linee guida per l’omogenea applicazione da parte delle stazioni appaltanti delle funzioni del Collegio consultivo tecnico nella Regione Siciliana - Approvazione",infrastrutture e mobilita',,,,https://www2.regione.sicilia.it/deliberegiunta/file/giunta/allegati/N.242_08.08.2025.pdf,2025,"Fri, 08 Aug 2025 00:00:00 +0000",2025-08-08
241,08/08/2025,"Decreto legislativo 19 agosto 2016, n. 175 e successive modifiche ed integrazioni, articolo 20. Piano di razionalizzazione delle partecipazioni pubbliche. Anno 2025",economia,,,,https://www2.regione.sicilia.it/deliberegiunta/file/giunta/allegati/N.241_08.08.2025.pdf,2025,"Fri, 08 Aug 2025 00:00:00 +0000",2025-08-08
240,08/08/2025,"Riaccertamento ordinario dei residui attivi e passivi al 31 dicembre 2024. Articolo 3, comma 4, del decreto legislativo 23 giugno 2011, n. 118 e successive modifiche ed integrazioni.",economia,,,,https://www2.regione.sicilia.it/deliberegiunta/file/giunta/allegati/N.240_08.08.2025.pdf,2025,"Fri, 08 Aug 2025 00:00:00 +0000",2025-08-08
239,08/08/2025,"Programma regionale FESR Sicilia 2021/2027. Azioni 1.6.1 &apos;Promozione di investimenti per lo sviluppo e la fabbricazione delle tecnologie digitali, delle innovazioni, delle tecnologie deep tech e delle biotecnologie&apos; e 2.9.1 &apos;Sostenere lo sviluppo e la fabbricazione di tecnologie pulite ed efficienti sotto il profilo delle risorse&apos;. Approvazione delle Basi giuridiche",attivita' produttive,,,,https://www2.regione.sicilia.it/deliberegiunta/file/giunta/allegati/N.239_08.08.2025.pdf,2025,"Fri, 08 Aug 2025 00:00:00 +0000",2025-08-08
238,08/08/2025,Atto di indirizzo del Governo regionale all&apos;ARAN Sicilia per la contrattazione collettivaregionale integrativa di cui all&apos;articolo 8 del Contratto Collettivo Regionale di Lavoro 2019-2021 del personale dell&apos;Area della dirigenza – anno 2025,autonomie locali e funzione pubblica,,,,https://www2.regione.sicilia.it/deliberegiunta/file/giunta/allegati/N.238_08.08.2025.pdf,2025,"Fri, 08 Aug 2025 00:00:00 +0000",2025-08-08
237,08/08/2025,Progetto PNRR esperti. - Sub-investimento 2.2.1 &quot;Assistenza tecnica a livello centrale e locale&quot; del PNRR. &quot;Piano territoriale per il conferimento di incarichi di collaborazione per il supporto ai procedimenti amministrativi connessi all&apos;attuazione del PNRR&quot;. Codice CUP G61B21009850006 - Aggiornamento Piano territoriale,autonomie locali e funzione pubblica,,,,https://www2.regione.sicilia.it/deliberegiunta/file/giunta/allegati/N.237_08.08.2025.pdf,2025,"Fri, 08 Aug 2025 00:00:00 +0000",2025-08-08
236,08/08/2025,"Programma Regionale FESR Sicilia 2021/2027. Priorità 2. Obiettivo Specifico 2.5 &apos;Promuovere l&apos;accesso all&apos;acqua e la sua gestione sostenibile&apos;. Azioni 2.5.2 e 2.5.3. POC Sicilia 2014/2020. Asse 2 &apos;Sostenere l&apos;attuazione del green deal europeo&apos;. Azioni 2.3.1, 2.3.2 e 2.4.3. Rimodulazione finanziaria",presidenza,,,,https://www2.regione.sicilia.it/deliberegiunta/file/giunta/allegati/N.236_08.08.2025.pdf,2025,"Fri, 08 Aug 2025 00:00:00 +0000",2025-08-08
235,08/08/2025,Programma Regionale FESR Sicilia 2021/2027. Priorità 1. Obiettivo Specifico 1.1. &apos;Sviluppare e rafforzare le capacità di ricerca e di innovazione e l&apos;introduzione di tecnologie avanzate&apos;. Azioni 1.1.1 e 1.1.4. Obiettivo Specifico 1.3 &apos;Rafforzare la crescita sostenibile e la competitività delle PMI e la creazione di posti di lavoro nelle PMI anche grazie agli investimenti produttivi&apos;. Azioni 1.3.2 e 1.3.4. Rimodulazione finanziaria,presidenza,,,,https://www2.regione.sicilia.it/deliberegiunta/file/giunta/allegati/N.235_08.08.2025.pdf,2025,"Fri, 08 Aug 2025 00:00:00 +0000",2025-08-08
234,30/07/2025,Piano di risanamento Azienda siciliana trasporti s.p.a. Aggiornamento,economia,,,,https://www2.regione.sicilia.it/deliberegiunta/file/giunta/allegati/N.234_30.07.2025.pdf,2025,"Wed, 30 Jul 2025 00:00:00 +0000",2025-07-30
233,30/07/2025,"Opposizione del Comune di Milazzo ex articolo 21 della legge regionale 21 maggio 2019, n.7. Determinazione conclusiva positiva della conferenza dei servizi in forma simultanea ed in modalità sincrona - Richiesta di concessione demaniale marittima",presidenza,,,,https://www2.regione.sicilia.it/deliberegiunta/file/giunta/allegati/N.233_30.07.2025.pdf,2025,"Wed, 30 Jul 2025 00:00:00 +0000",2025-07-30
232,30/07/2025,"Legge regionale 7 maggio 2015, n. 9, articolo 65 – Fondo Unico Regionale per lo Spettacolo (FURS) – Anno 2025. Schema di decreto assessoriale di approvazione dell&apos;Avviso per l&apos;accesso al Fondo di enti, associazioni e fondazioni a partecipazione pubblica","turismo, sport e spettacolo",,,,https://www2.regione.sicilia.it/deliberegiunta/file/giunta/allegati/N.232_30.07.2025.pdf,2025,"Wed, 30 Jul 2025 00:00:00 +0000",2025-07-30
231,30/07/2025,"Accordo Istituzionale ex articolo 7, comma 4, del decreto legislativo 31 marzo 2023, n. 36 ed ex articolo 15 della legge 7 agosto 1990, n. 241, tra l&apos;Assessorato regionale della famiglia, delle politiche sociali e del lavoro e l&apos; Ente Nazionale per il Microcredito per l&apos;attuazione di iniziative finalizzate allo sviluppo e al rafforzamento delle politiche attive del lavoro","famiglia, politiche sociali e del lavoro",,,,https://www2.regione.sicilia.it/deliberegiunta/file/giunta/allegati/N.231_30.07.2025.pdf,2025,"Wed, 30 Jul 2025 00:00:00 +0000",2025-07-30
230,30/07/2025,"Fondo per le Politiche Giovanili, Anno 2025. Intesa Rep. Atti n.127/CU del 17 ottobre 2024 - Piano finanziario di dettaglio 2025","famiglia, politiche sociali e del lavoro",,,,https://www2.regione.sicilia.it/deliberegiunta/file/giunta/allegati/N.230_30.07.2025.pdf,2025,"Wed, 30 Jul 2025 00:00:00 +0000",2025-07-30
229,30/07/2025,Programma Regionale FESR Sicilia 2021-2027 – Azione 1.1.2 “Sostegno all&apos;innovazione delle imprese” - Approvazione modifica base giuridica,attivita' produttive,,,,https://www2.regione.sicilia.it/deliberegiunta/file/giunta/allegati/N.229_30.07.2025.pdf,2025,"Wed, 30 Jul 2025 00:00:00 +0000",2025-07-30
228,30/07/2025,"Elenchi dei soggetti del Gruppo Amministrazione Pubblica della Regione Siciliana ai sensi dell&apos;Allegato 4/4 al decreto legislativo 23 giugno 2011, n. 118 e successive modifiche ed integrazioni. Anno 2024",economia,,,,https://www2.regione.sicilia.it/deliberegiunta/file/giunta/allegati/N.228_30.07.2025.pdf,2025,"Wed, 30 Jul 2025 00:00:00 +0000",2025-07-30
227,30/07/2025,"Approvazione Disegno di legge «Modifiche e integrazioni alla legge regionale 14 dicembre 2019, n. 23 recante &apos;Istituzione del sistema regionale della formazione professionale&apos;",istruzione e formazione professionale,,,979,https://www2.regione.sicilia.it/deliberegiunta/file/giunta/allegati/N.227_30.07.2025%20con%20omissis.pdf,2025,"Wed, 30 Jul 2025 00:00:00 +0000",2025-07-30
226,30/07/2025,"Legge regionale 13 agosto 1979, n. 200 e successive modificazioni – Piano di ripartizione dei finanziamenti da assegnare agli Enti gestori delle Scuole di servizio sociale per l&apos;Anno Accademico 2024/2025 – Esercizio finanziario 2025. Apprezzamento",istruzione e formazione professionale,,,,https://www2.regione.sicilia.it/deliberegiunta/file/giunta/allegati/N.226_30.07.2025.pdf,2025,"Wed, 30 Jul 2025 00:00:00 +0000",2025-07-30
225,30/07/2025,"Convenzione tra l&apos;Assessorato Regionale dell&apos;Istruzione e della Formazione Professionale e il CNR-IBF per la promozione, diffusione e sviluppo della ricerca neuroscientifica in Sicilia",istruzione e formazione professionale,,,,https://www2.regione.sicilia.it/deliberegiunta/file/giunta/allegati/N.225_30.07.2025%20con%20omissis.pdf,2025,"Wed, 30 Jul 2025 00:00:00 +0000",2025-07-30
224,30/07/2025,Riorganizzazione competenze Ufficio Stampa e documentazione della Presidenza della Regione,presidenza,,,,https://www2.regione.sicilia.it/deliberegiunta/file/giunta/allegati/N.224_30.07.2025.pdf,2025,"Wed, 30 Jul 2025 00:00:00 +0000",2025-07-30
223,30/07/2025,Fabbisogno di personale dell’ufficio del Commissario di governo per il contrasto del dissesto idrogeologico nella Regione Siciliana,presidenza,,,,https://www2.regione.sicilia.it/deliberegiunta/file/giunta/allegati/N.223_30.07.2025.pdf,2025,"Wed, 30 Jul 2025 00:00:00 +0000",2025-07-30
222,30/07/2025,Piano Sviluppo e Coesione (PSC) della Regione Siciliana. Documento &apos;Sistema di gestione e controllo (SI.GE.CO.)&apos;. Modifica e integrazione,presidenza,,,,https://www2.regione.sicilia.it/deliberegiunta/file/giunta/allegati/N.222_30.07.2025.pdf,2025,"Wed, 30 Jul 2025 00:00:00 +0000",2025-07-30
221,30/07/2025,"PR FESR SICILIA 2021-2027. Conferimento di funzioni di Organismo Intermedio alla struttura del &apos;Commissario Straordinario Unico per la realizzazione degli interventi di collettamento, fognatura e depurazione delle acque reflue urbane&apos;, per l&apos;attuazione dell&apos;Azione 2.5.1 &apos;Interventi per il miglioramento del Servizio idrico Integrato in tutti i segmenti della filiera&apos; da parte del Dipartimento regionale dell’acqua e dei rifiuti",presidenza,,,,https://www2.regione.sicilia.it/deliberegiunta/file/giunta/allegati/N.221_30.07.2025.pdf,2025,"Wed, 30 Jul 2025 00:00:00 +0000",2025-07-30
220,30/07/2025,"Autorizzazione per la costituzione di parte civile della Presidenza della Regione Siciliana nel procedimento penale n.XXXXXXXXXXX, a carico di XXXXXXXXX, pendente presso il Tribunale di XXXXXXXX",presidenza,,,,https://www2.regione.sicilia.it/deliberegiunta/file/giunta/allegati/N.220_30.07.2025%20con%20omissis.pdf,2025,"Wed, 30 Jul 2025 00:00:00 +0000",2025-07-30
219,30/07/2025,"Schema Protocollo d&apos;Intesa tra la Regione Siciliana, la Saint Camillus International University of Health Sciences Università Medica internazionale di Roma e la Fondazione Istituto G. Giglio di Cefalù PA - Apprezzamento",salute,,,,https://www2.regione.sicilia.it/deliberegiunta/file/giunta/allegati/N.219_30.07.2025.pdf,2025,"Wed, 30 Jul 2025 00:00:00 +0000",2025-07-30
218,30/07/2025,Iter di approvazione del Progetto definitivo di Variante della Viabilità NV02 (CUP J11H03000180001) “Lotto 1+2: Tratta Fiumetorto-Lercara Diramazione” del Nuovo collegamento ferroviario Palermo-Catania - Presa d&apos;atto,infrastrutture e mobilita',,,,https://www2.regione.sicilia.it/deliberegiunta/file/giunta/allegati/N.218_30.07.2025.pdf,2025,"Wed, 30 Jul 2025 00:00:00 +0000",2025-07-30
217,22/07/2025,"Lavori per la riqualificazione dell&apos;aiuola di Via Mariano d&apos;Amelio, in Palermo, mediante sistemazione del verde ed opere di decoro urbano. Finanziamento a valere sulle risorse del capitolo 214920 del bilancio della Regione Siciliana",presidenza,,Spesa,,https://www2.regione.sicilia.it/deliberegiunta/file/giunta/allegati/N.217_22.07.2025.pdf,2025,"Tue, 22 Jul 2025 00:00:00 +0000",2025-07-22
216,22/07/2025,"Autorizzazione per la costituzione parte civile della Regione Siciliana e, segnatamente, dell&apos;Assessorato regionale dell&apos;agricoltura, dello sviluppo rurale e della pesca mediterranea e dell&apos;Assessorato regionale delle attività produttive, nel procedimento penale n. XXXXXXX XXXXXX XXXXXX XX XXXXXX., a carico di XXXXXXX XXXXXX XXXX, pendente presso il Tribunale di XXXXXXX",presidenza,,,,https://www2.regione.sicilia.it/deliberegiunta/file/giunta/allegati/N.216_22.07.2025%20con%20omissis.pdf,2025,"Tue, 22 Jul 2025 00:00:00 +0000",2025-07-22
215,10/07/2025,"Gestione degli impianti di dissalazione in Gela, Porto Empedocle e Trapani e del relativo servizio di erogazione di acqua per uso potabile - Atto integrativo alla Convenzione 20 aprile 2004, rep. 10994 tra Regione Siciliana e Siciliacque S.p.A.",energia e servizi di pubblica utilita',,,,https://www2.regione.sicilia.it/deliberegiunta/file/giunta/allegati/N.215_10.07.2025_con%20omissis.pdf,2025,"Thu, 10 Jul 2025 00:00:00 +0000",2025-07-10
214,10/07/2025,"Approvazione disegno di legge: &apos;Riconoscimento della legittimità dei debiti fuori bilancio ai sensi dell&apos;articolo 73, comma 1, lettera e) del decreto legislativo 23 giugno 2011, n. 118 e successive modifiche ed integrazioni. D.F.B. 2025. Mese di Maggio&apos;",economia,,,974,https://www2.regione.sicilia.it/deliberegiunta/file/giunta/allegati/N.214_10.07.2025%20con%20omissis.pdf,2025,"Thu, 10 Jul 2025 00:00:00 +0000",2025-07-10
213,10/07/2025,"Approvazione disegno di legge: &apos;Riconoscimento della legittimità dei debiti fuori bilancio ai sensi dell&apos;articolo 73, comma 1, lettera a) del decreto legislativo 23 giugno 2011, n. 118 e successive modifiche ed integrazioni. D.F.B. 2025. Mese di Maggio",economia,,,973,https://www2.regione.sicilia.it/deliberegiunta/file/giunta/allegati/N.213_10.07.2025%20con%20omissis.pdf,2025,"Thu, 10 Jul 2025 00:00:00 +0000",2025-07-10
212,10/07/2025,Approvazione disegno di legge: &apos;Variazioni al bilancio della Regione per l&apos;esercizio finanziario 2025 e per il triennio 2025/2027,economia,,,,https://www2.regione.sicilia.it/deliberegiunta/file/giunta/allegati/N.212_10.07.2025_con%20omissis.pdf,2025,"Thu, 10 Jul 2025 00:00:00 +0000",2025-07-10
211,08/07/2025,Programma Regionale FESR Sicilia 2021/2027. Riprogrammazione in applicazione del Regolamento (UE) 2024/3236 (RESTORE) del Parlamento europeo e del Consiglio del 19 dicembre 2024 che modifica i regolamenti (UE) 2021/1057 e (UE) 2021/1058 per quanto riguarda il sostegno regionale di emergenza per la ricostruzione (RESTORE). Misure straordinarie di sostegno alla ricostruzione post-catastrofi naturali,presidenza,,,,https://www2.regione.sicilia.it/deliberegiunta/file/giunta/allegati/N.211_08.07.2025.pdf,2025,"Tue, 08 Jul 2025 00:00:00 +0000",2025-07-08
210,01/07/2025,"Fondi destinati all&apos;acquisto di materiale rotabile di cui al Decreto del Ministero delle Infrastrutture e dei Trasporti 14 febbraio 2020, n. 81 - Rimodulazione somme 2° quinquennio 2024/2028",infrastrutture e mobilita',,,,https://www2.regione.sicilia.it/deliberegiunta/file/giunta/allegati/N.210_01.07.2025.pdf,2025,"Tue, 01 Jul 2025 00:00:00 +0000",2025-07-01
209,01/07/2025,"Utilizzo dei fondi previsti dalla legge regionale 30 gennaio 2025, n. 3, articoli 36 e 54, per la realizzazione degli interventi di manutenzione straordinaria, riattamento e adeguamento degli impianti di depurazione esistenti o in costruzione o in progetto",energia e servizi di pubblica utilita',,,,https://www2.regione.sicilia.it/deliberegiunta/file/giunta/allegati/N.209_01.07.2025.pdf,2025,"Tue, 01 Jul 2025 00:00:00 +0000",2025-07-01
208,01/07/2025,"Richiesta stanziamento somme a valere sulle risorse disponibili sul capitolo di spesa 613954, collegato al capitolo di entrata 1607, denominato “Fondo cui fare affluire il gettito del tributo speciale relativo al deposito in discarica dei rifiuti solidi”, per la discarica sita in C.da Formaggiara, nel Comune di Tripi – Abakainon (ME), per interventi di &apos;Prelievo e smaltimento percolato e acque di falda&apos;",energia e servizi di pubblica utilita',,,,https://www2.regione.sicilia.it/deliberegiunta/file/giunta/allegati/N.208_01.07.2025.pdf,2025,"Tue, 01 Jul 2025 00:00:00 +0000",2025-07-01
207,01/07/2025,Consorzio A.S.I. di Enna in liquidazione - Attivazione procedura di liquidazione coatta amministrativa,economia,,,,https://www2.regione.sicilia.it/deliberegiunta/file/giunta/allegati/N.207_01.07.2025.pdf,2025,"Tue, 01 Jul 2025 00:00:00 +0000",2025-07-01
206,01/07/2025,"Approvazione disegno di legge: &apos;Riconoscimento della legittimità dei debiti fuori bilancio ai sensi dell&apos;articolo 73, comma 1, lettera e) del decreto legislativo 23 giugno 2011, n. 118 e successive modifiche ed integrazioni. D.F.B. 2025. Mese di Aprile&apos;",economia,,,970,https://www2.regione.sicilia.it/deliberegiunta/file/giunta/allegati/N.206_01.07.2025%20con%20omissis.pdf,2025,"Tue, 01 Jul 2025 00:00:00 +0000",2025-07-01
205,01/07/2025,"Fondo per il sostegno del ruolo di cura e di assistenza del caregiver familiare, annualità 2024. Apprezzamento","famiglia, politiche sociali e del lavoro",,,,https://www2.regione.sicilia.it/deliberegiunta/file/giunta/allegati/N.205_01.07.2025.pdf,2025,"Tue, 01 Jul 2025 00:00:00 +0000",2025-07-01
204,01/07/2025,Programma Regionale FESR Sicilia 2021-2027 – Azioni 1.1.1 – 1.1.2 – 1.1.3 – 1.2.2 - 1.4.1- 2.1.2 – Approvazione basi giuridiche,attivita' produttive,,,,https://www2.regione.sicilia.it/deliberegiunta/file/giunta/allegati/N.204_01.07.2025.pdf,2025,"Tue, 01 Jul 2025 00:00:00 +0000",2025-07-01
203,01/07/2025,"Articolo 3 della legge regionale 7 luglio 2020, n. 13. Dichiarazione dello stato di crisi e di emergenza regionale. Evento del 10 dicembre 2024 in Caltanissetta, Via Redentore n. 39 e n. 20, Vicolo Scilla n. 29, Via Redentore n. 179, Via San Giovanni Bosco n. 65",presidenza,,,,https://www2.regione.sicilia.it/deliberegiunta/file/giunta/allegati/N.203_01.07.2025.pdf,2025,"Tue, 01 Jul 2025 00:00:00 +0000",2025-07-01
202,01/07/2025,Politiche territoriali della Regione Siciliana per il periodo di programmazione 2021/2027. Piano Strategico Nazionale Aree Interne (PSNAI). Individuazione della struttura amministrativa con il ruolo di Autorità Responsabile per le Aree Interne (ARAI),presidenza,,,,https://www2.regione.sicilia.it/deliberegiunta/file/giunta/allegati/N.202_01.07.2025.pdf,2025,"Tue, 01 Jul 2025 00:00:00 +0000",2025-07-01
201,01/07/2025,"Atto di proroga del Protocollo d&apos;Intesa tra la Regione Siciliana e l&apos;ISTAT, sottoscritto l&apos;11 luglio 2022, in tema di supporto delle analisi statistiche sociali, economiche e ambientali per la programmazione della politica unitaria di coesione 2021-2027 della Regione Siciliana, dei relativi strumenti di pianificazione, attuazione, monitoraggio e valutazione e per il rafforzamento della funzione statistica in forma associata. Apprezzamento",presidenza,,,,https://www2.regione.sicilia.it/deliberegiunta/file/giunta/allegati/N.201_01.07.2025.pdf,2025,"Tue, 01 Jul 2025 00:00:00 +0000",2025-07-01
200,30/06/2025,"Deliberazione della Giunta regionale 17 giugno 2025, n. 187 - Relazione sulla performance 2024 – Refusi. Apprezzamento",presidenza,,,,https://www2.regione.sicilia.it/deliberegiunta/file/giunta/allegati/N.200_30.06.2025.pdf,2025,"Mon, 30 Jun 2025 00:00:00 +0000",2025-06-30
199,30/06/2025,Documento di Economia e Finanza Regionale (DEFR) 2026/2028 – Approvazione,economia,,,,https://www2.regione.sicilia.it/deliberegiunta/file/giunta/allegati/N.199_30.06.2025.pdf,2025,"Mon, 30 Jun 2025 00:00:00 +0000",2025-06-30
198,17/06/2025,Fondazione per l’arte e la cultura “Lauro Chiazzese” - Nomina Commissario,presidenza,Nomine,,,https://www2.regione.sicilia.it/deliberegiunta/file/giunta/allegati/N.198_17.06.2025_con%20omissis.pdf,2025,"Tue, 17 Jun 2025 00:00:00 +0000",2025-06-17
197,17/06/2025,Affidamento del servizio in house del Trasporto Pubblico Locale (TPL) extraurbano all’Azienda Siciliana Trasporti S.p.A. - Presa d&apos;atto,infrastrutture e mobilita',,,,https://www2.regione.sicilia.it/deliberegiunta/file/giunta/allegati/N.197_17.06.2025.pdf,2025,"Tue, 17 Jun 2025 00:00:00 +0000",2025-06-17
196,17/06/2025,"Azienda Siciliana Trasporti S.p.A. Articolo 1 della legge regionale 4 luglio 2024, n. 23 e successive modifiche e integrazioni. Perfezionamento della trasformazione in house in esito alle modifiche statutarie approvate dall’Assemblea dei soci – Presa d&apos;atto",economia,,,,https://www2.regione.sicilia.it/deliberegiunta/file/giunta/allegati/N.196_17.06.2025.pdf,2025,"Tue, 17 Jun 2025 00:00:00 +0000",2025-06-17
195,17/06/2025,"Approvazione disegno di legge: &apos;Riconoscimento della legittimità dei debiti fuori bilancio ai sensi dell&apos;articolo 73, comma 1, lettera a del decreto legislativo 23 giugno 2011, n. 118 e successive modifiche ed integrazioni. D.F.B. 2025. Mese di Aprile",economia,,,965,https://www2.regione.sicilia.it/deliberegiunta/file/giunta/allegati/N.195_17.06.2025%20con%20omissis.pdf,2025,"Tue, 17 Jun 2025 00:00:00 +0000",2025-06-17
194,17/06/2025,"Incarico di Dirigente generale del Dipartimento regionale del turismo, dello sport e dello spettacolo dell&apos;Assessorato regionale del turismo, dello sport e dello spettacolo - Proroga tecnica",autonomie locali e funzione pubblica,,,,https://www2.regione.sicilia.it/deliberegiunta/file/giunta/allegati/N.194_17.06.2025.pdf,2025,"Tue, 17 Jun 2025 00:00:00 +0000",2025-06-17
193,17/06/2025,"Incarico di Dirigente generale del Dipartimento regionale del lavoro, dell’impiego, dell’orientamento, dei servizi e delle attività formative dell’Assessorato regionale della famiglia, delle politiche sociali e del lavoro - Proroga tecnica",autonomie locali e funzione pubblica,,,,https://www2.regione.sicilia.it/deliberegiunta/file/giunta/allegati/N.193_17.06.2025.pdf,2025,"Tue, 17 Jun 2025 00:00:00 +0000",2025-06-17
192,17/06/2025,Incarico di Dirigente generale dell&apos;Ufficio Speciale Autorità di Audit dei programmi Cofinanziati dalla Commissione Europea della Presidenza della Regione - Proroga tecnica,autonomie locali e funzione pubblica,,,,https://www2.regione.sicilia.it/deliberegiunta/file/giunta/allegati/N.192_18.06.2025.pdf,2025,"Tue, 17 Jun 2025 00:00:00 +0000",2025-06-17
191,17/06/2025,Atto di indirizzo del Governo regionale ai Dirigenti generali. Funzionalità dell&apos;Amministrazione regionale. Scadenza dei contratti,presidenza,,,,https://www2.regione.sicilia.it/deliberegiunta/file/giunta/allegati/N.191_17.06.2025.pdf,2025,"Tue, 17 Jun 2025 00:00:00 +0000",2025-06-17
190,17/06/2025,"Contrattazione collettiva regionale integrativa anno 2024, ex articolo 8 del CCRL 2016-2018 dell&apos;area della dirigenza della Regione Siciliana e degli Enti di cui all&apos;articolo 1 della legge regionale 15 maggio 2000, n. 10. Apprezzamento",autonomie locali e funzione pubblica,,,,https://www2.regione.sicilia.it/deliberegiunta/file/giunta/allegati/N.190_17.06.2025.pdf,2025,"Tue, 17 Jun 2025 00:00:00 +0000",2025-06-17
189,17/06/2025,"Articolo 6 del decreto-legge 9 giugno 2021, n. 80, convertito, con modificazioni, dalla legge 6 agosto 2021, n. 113 - Piano Integrato di Attività e Organizzazione (PIAO) della Regione Siciliana 2025-2027. Integrazione e rettifica della deliberazione della Giunta regionale 30 gennaio 2025, n. 23. Approvazione",presidenza,,,,https://www2.regione.sicilia.it/deliberegiunta/file/giunta/allegati/N.189_17.06.2025.pdf,2025,"Tue, 17 Jun 2025 00:00:00 +0000",2025-06-17
188,17/06/2025,"Postazione dirigenziale vacante presso il Dipartimento regionale del cerimoniale e dei siti presidenziali della Presidenza della Regione. Conferimento incarico dirigenziale ai sensi dell&apos;articolo 19, comma 6, del decreto legislativo 30 marzo 2001, n. 165 e successive modifiche e integrazioni",presidenza,,,,https://www2.regione.sicilia.it/deliberegiunta/file/giunta/allegati/N.188_17.06.2025.pdf,2025,"Tue, 17 Jun 2025 00:00:00 +0000",2025-06-17
187,17/06/2025,Relazione sulla performance 2024 – Apprezzamento,presidenza,,,,https://www2.regione.sicilia.it/deliberegiunta/file/giunta/allegati/N.187_17.06.2025.pdf,2025,"Tue, 17 Jun 2025 00:00:00 +0000",2025-06-17
186,17/06/2025,Sistema di segnalazione,presidenza,,,,https://www2.regione.sicilia.it/deliberegiunta/file/giunta/allegati/N.186_17.06.2025.pdf,2025,"Tue, 17 Jun 2025 00:00:00 +0000",2025-06-17
185,17/06/2025,Revoca dell&apos;incarico di Presidente dell&apos;Organismo Indipendente di Valutazione OIV della performance della Regione Siciliana - Presa d’atto e ratifica,presidenza,,,,https://www2.regione.sicilia.it/deliberegiunta/file/giunta/allegati/N.185_17.06.2025%20con%20omissis.pdf,2025,"Tue, 17 Jun 2025 00:00:00 +0000",2025-06-17
184,10/06/2025,Consorzio Universitario di Siracusa &apos;Giovanni Paolo II&apos; - Consiglio di Amministrazione - Nomina componente con funzioni di Presidente,istruzione e formazione professionale,Nomine,,,https://www2.regione.sicilia.it/deliberegiunta/file/giunta/allegati/N.184_10.06.2025%20con%20omissis.pdf,2025,"Tue, 10 Jun 2025 00:00:00 +0000",2025-06-10
183,10/06/2025,"Approvazione disegno di legge: “Recepimento del decreto legislativo 31 dicembre 2024, n. 209, &apos;Disposizioni integrative e correttive al codice dei contratti pubblici di cui al decreto legislativo 31 marzo 2023, n. 36&apos;. Modifiche alla legge regionale 12 luglio 2011, n.12 e successive modifiche e integrazioni”",infrastrutture e mobilita',,,,https://www2.regione.sicilia.it/deliberegiunta/file/giunta/allegati/N.183_10.06.2025.pdf,2025,"Tue, 10 Jun 2025 00:00:00 +0000",2025-06-10
182,10/06/2025,"Programmazione FSC 2021-2027 – Area Tematica 03 Competitività Imprese – Linea di Intervento 03.02 Turismo e Ospitalità, comprensiva delle “Agevolazioni per le imprese del settore turistico alberghiero ed extra-alberghiero”. Avviso approvato con DDG n. 4613 del 19 dicembre 2024. Rettifica base giuridica. Approvazione","turismo, sport e spettacolo",,,,https://www2.regione.sicilia.it/deliberegiunta/file/giunta/allegati/N.182_10.06.2025.pdf,2025,"Tue, 10 Jun 2025 00:00:00 +0000",2025-06-10
181,10/06/2025,Fondo per l&apos;inclusione delle persone sorde e con ipoacusia - Annualità 2023&apos;. Apprezzamento,"famiglia, politiche sociali e del lavoro",,,,https://www2.regione.sicilia.it/deliberegiunta/file/giunta/allegati/N.181_10.06.2025.pdf,2025,"Tue, 10 Jun 2025 00:00:00 +0000",2025-06-10
180,10/06/2025,Mandato al Dipartimento regionale della funzione pubblica e del personale per l’indizione di Atto d’interpello per il conferimento dell&apos;incarico di Dirigente generale del Dipartimento regionale dell’energia dell’Assessorato regionale dell’energia e dei servizi di pubblica utilità,autonomie locali e funzione pubblica,,,,https://www2.regione.sicilia.it/deliberegiunta/file/giunta/allegati/N.180_10.06.2025.pdf,2025,"Tue, 10 Jun 2025 00:00:00 +0000",2025-06-10
179,10/06/2025,Convenzione tra la Regione Siciliana e AMAT Palermo S.p.A. per l&apos;utilizzo dei servizi TPL. Apprezzamento,autonomie locali e funzione pubblica,,,,https://www2.regione.sicilia.it/deliberegiunta/file/giunta/allegati/N.179_10.06.2025.pdf,2025,"Tue, 10 Jun 2025 00:00:00 +0000",2025-06-10
178,10/06/2025,"Atto di indirizzo del Governo Regionale per il rinnovo del contratto collettivo regionale di lavoro (C.C.R.L.) del personale del comparto non dirigenziale della Regione Siciliana e degli Enti di cui all&apos;articolo 1 della legge regionale 15 maggio 2000, n.10 - Triennio 2022-2024",autonomie locali e funzione pubblica,,,,https://www2.regione.sicilia.it/deliberegiunta/file/giunta/allegati/N.178_10.06.2025.pdf,2025,"Tue, 10 Jun 2025 00:00:00 +0000",2025-06-10
177,10/06/2025,"Atto di indirizzo del Governo Regionale per il rinnovo del contratto collettivo regionale di lavoro (C.C.R.L.) del personale dell&apos;Area della dirigenza della Regione Siciliana e degli Enti di cui all&apos;articolo 1 della legge regionale 15 maggio 2000, n.10 - Triennio 2022- 2024",autonomie locali e funzione pubblica,,,,https://www2.regione.sicilia.it/deliberegiunta/file/giunta/allegati/N.177_10.06.2025.pdf,2025,"Tue, 10 Jun 2025 00:00:00 +0000",2025-06-10
176,10/06/2025,"Programmazione risorse PR FESR Sicilia 2021/2027 e FSC 2021/2027. Accordo di Programma tra la Regione Siciliana, il MIMIT e l’Agenzia Nazionale per l’attrazione degli investimenti e lo sviluppo d’impresa – INVITALIA S.p.A. finalizzato all&apos;attivazione del cofinanziamento regionale delle iniziative avviate a valere sugli strumenti agevolativi nazionali denominati &apos;Contratti di Sviluppo&apos; e schema di Convenzione per l’identificazione del MIMIT-DGIAI quale Organismo Intermedio",attivita' produttive,,,,https://www2.regione.sicilia.it/deliberegiunta/file/giunta/allegati/N.176_10.06.2025.pdf,2025,"Tue, 10 Jun 2025 00:00:00 +0000",2025-06-10
175,10/06/2025,"Articolo 37 della legge regionale 30 gennaio 2025, n. 3 - Misure a favore della crescita economica - Schema di decreto assessoriale. Apprezzamento",economia,,,,https://www2.regione.sicilia.it/deliberegiunta/file/giunta/allegati/N.175_10.06.2025.pdf,2025,"Tue, 10 Jun 2025 00:00:00 +0000",2025-06-10
174,10/06/2025,"Istituto Regionale del Vino e dell&apos;Olio – Delibera del Commissario straordinario 30 aprile 2024, n. 17 - Approvazione Rendiconto Generale – Esercizio finanziario 2024","agricoltura, sviluppo rurale e pesca mediterranea",,,,https://www2.regione.sicilia.it/deliberegiunta/file/giunta/allegati/N.174_10.06.2025%20con%20omissis.pdf,2025,"Tue, 10 Jun 2025 00:00:00 +0000",2025-06-10
173,10/06/2025,"Riapprovazione disegno di legge: &apos;Riconoscimento della legittimità dei debiti fuori bilancio ai sensi dell&apos;articolo 73, comma 1, lettera a) del decreto legislativo 23 giugno 2011, n. 118 e successive modifiche ed integrazioni. D.F.B. 2024. Mesi di Novembre e Dicembre&apos;. Utilizzo capitolo 215740 &apos;Fondo rischi contenzioso spese legali&apos; del Bilancio regionale",economia,,,964,https://www2.regione.sicilia.it/deliberegiunta/file/giunta/allegati/N.173_10.06.2025%20con%20omissis.pdf,2025,"Tue, 10 Jun 2025 00:00:00 +0000",2025-06-10
172,10/06/2025,Incarico di Dirigente generale del Dipartimento regionale del bilancio e del tesoro - Ragioneria generale della Regione dell’Assessorato regionale dell’economia - Proroga tecnica,autonomie locali e funzione pubblica,,,,https://www2.regione.sicilia.it/deliberegiunta/file/giunta/allegati/N.172_10.06.2025.pdf,2025,"Tue, 10 Jun 2025 00:00:00 +0000",2025-06-10
171,10/06/2025,"Decreto legislativo 2 gennaio 2018, n. 1 &apos;Codice della protezione civile&apos; - Art. 24 - Richiesta di deliberazione dello stato di emergenza di rilievo nazionale per gli eventi meteo avversi che hanno interessato il territorio della provincia di Messina nei giorni dal 28 marzo 2025 al 5 aprile 2025. Estensione della richiesta di cui alle deliberazioni della Giunta regionale 11 dicembre 2024 n. 413 e 14 febbraio 2025, n. 56",presidenza,,,,https://www2.regione.sicilia.it/deliberegiunta/file/giunta/allegati/N.171_10.06.2025.pdf,2025,"Tue, 10 Jun 2025 00:00:00 +0000",2025-06-10
170,10/06/2025,"Articolo 3 della legge regionale 7 luglio 2020, n. 13. Dichiarazione dello stato di crisi e di emergenza regionale per gli eventi meteo avversi che hanno interessato il territorio della provincia di Messina nei giorni dal 28 marzo 2025 al 5 aprile 2025",presidenza,,,,https://www2.regione.sicilia.it/deliberegiunta/file/giunta/allegati/N.170_10.06.2025.pdf,2025,"Tue, 10 Jun 2025 00:00:00 +0000",2025-06-10
169,10/06/2025,"Articolo 11 del decreto-legge 28 aprile 2009, n. 39, convertito con modificazioni dalla legge 24 giugno 2009, n. 77. Contributi per interventi di prevenzione del rischio sismico, annualità 2010-2016. Salvaguardia delle risorse già assegnate e trasferite alla Regione Siciliana",presidenza,,Spesa,,https://www2.regione.sicilia.it/deliberegiunta/file/giunta/allegati/N.169_10.06.2025.pdf,2025,"Tue, 10 Jun 2025 00:00:00 +0000",2025-06-10
168,10/06/2025,Incarico di Avvocato generale dell&apos;Ufficio legislativo e legale della Presidenza della Regione - Differimento della data di scadenza,autonomie locali e funzione pubblica,,,,https://www2.regione.sicilia.it/deliberegiunta/file/giunta/allegati/N.168_10.06.2025.pdf,2025,"Tue, 10 Jun 2025 00:00:00 +0000",2025-06-10
167,27/05/2025,"Modifica Deliberazione della Giunta regionale 14 novembre 2024, n. 364: Programma Operativo Complementare Sicilia 2014/2020. Asse 3 Sostenere la connessione regionale attraverso il rafforzamento della mobilità e delle infrastrutture di trasporto. Riprogrammazione della dotazione assegnata al Dipartimento regionale delle infrastrutture, della mobilità e dei trasporti. Ampliamento al Dipartimento regionale tecnico",infrastrutture e mobilita',,,,https://www2.regione.sicilia.it/deliberegiunta/file/giunta/allegati/N.167_27.05.2025.pdf,2025,"Tue, 27 May 2025 00:00:00 +0000",2025-05-27
166,27/05/2025,"Differimento della data di scadenza dell&apos;incarico, conferito all’arch. Roberto Sciarratta, di Direttore del Parco archeologico e paesaggistico della Valle dei Templi di Agrigento",beni culturali e dell'identita' siciliana,,,,https://www2.regione.sicilia.it/deliberegiunta/file/giunta/allegati/N.166_27.05.2025%20con%20omissis.pdf,2025,"Tue, 27 May 2025 00:00:00 +0000",2025-05-27
165,27/05/2025,"Fondo Unico Regionale per lo Spettacolo FURS – Anno 2025 – Legge regionale 7 maggio 2015, n. 9, articolo 65 e successive modificazioni","turismo, sport e spettacolo",,,,https://www2.regione.sicilia.it/deliberegiunta/file/giunta/allegati/N.165_27.05.2025.pdf,2025,"Tue, 27 May 2025 00:00:00 +0000",2025-05-27
164,27/05/2025,Piano di comunicazione triennale FSE+ Sicilia 2021-2027 - Apprezzamento,istruzione e formazione professionale,,,,https://www2.regione.sicilia.it/deliberegiunta/file/giunta/allegati/N.164_27.05.2025.pdf,2025,"Tue, 27 May 2025 00:00:00 +0000",2025-05-27
163,27/05/2025,Manifestazione di interesse per la costituzione del Polo formativo territoriale SNA presso l&apos;Università degli Studi di Catania. Approvazione,istruzione e formazione professionale,,,,https://www2.regione.sicilia.it/deliberegiunta/file/giunta/allegati/N.163_27.05.2025.pdf,2025,"Tue, 27 May 2025 00:00:00 +0000",2025-05-27
162,27/05/2025,Fondo per le politiche della famiglia - Programmazione delle somme anno 2024,"famiglia, politiche sociali e del lavoro",,,,https://www2.regione.sicilia.it/deliberegiunta/file/giunta/allegati/N.162_27.05.2025.pdf,2025,"Tue, 27 May 2025 00:00:00 +0000",2025-05-27
161,27/05/2025,"Legge regionale 16 gennaio 2024, n.1, articolo 10. Iscrizione somme sui capitoli di spesa del bilancio regionale n. 313728 e n. 313005. Esercizio finanziario 2025","famiglia, politiche sociali e del lavoro",,,,https://www2.regione.sicilia.it/deliberegiunta/file/giunta/allegati/N.161_27.05.2025.pdf,2025,"Tue, 27 May 2025 00:00:00 +0000",2025-05-27
160,27/05/2025,"Approvazione disegno di legge: Riconoscimento della legittimità dei debiti fuori bilancio ai sensi dell&apos;articolo 73, comma 1, lettera e del decreto legislativo 23 giugno 2011, n. 118 e successive modifiche ed integrazioni. D.F.B. 2025. Mese di Marzo",economia,,,953,https://www2.regione.sicilia.it/deliberegiunta/file/giunta/allegati/N.160_27.05.2025%20con%20omissis.pdf,2025,"Tue, 27 May 2025 00:00:00 +0000",2025-05-27
159,27/05/2025,"Approvazione disegno di legge: &apos;Riconoscimento della legittimità dei debiti fuori bilancio ai sensi dell&apos;articolo 73, comma 1, lettera a) del decreto legislativo 23 giugno 2011, n. 118 e successive modifiche ed integrazioni. D.F.B. 2025. Mese di Marzo&apos;",economia,,,952,https://www2.regione.sicilia.it/deliberegiunta/file/giunta/allegati/N.159_27.05.2025_con%20omissis.pdf,2025,"Tue, 27 May 2025 00:00:00 +0000",2025-05-27
158,27/05/2025,"Articolo 16 della legge regionale 18 novembre 2024, n. 28. Disposizioni attuative. Apprezzamento schema di decreto",economia,,,,https://www2.regione.sicilia.it/deliberegiunta/file/giunta/allegati/N.158_27.05.2025.pdf,2025,"Tue, 27 May 2025 00:00:00 +0000",2025-05-27
157,27/05/2025,Procedura di mobilità lavoratori della Società AST S.p.a. alla Società SAS S.c.p.a,economia,,,,https://www2.regione.sicilia.it/deliberegiunta/file/giunta/allegati/N.157_27.05.2025.pdf,2025,"Tue, 27 May 2025 00:00:00 +0000",2025-05-27
156,27/05/2025,"Piano assunzionale Sicilia Digitale S.p.A. Articolo 14, comma 2, della legge regionale 25 maggio 2022, n. 13 - Approvazione",economia,,,,https://www2.regione.sicilia.it/deliberegiunta/file/giunta/allegati/N.156_27.05.2025%20con%20omissis.pdf,2025,"Tue, 27 May 2025 00:00:00 +0000",2025-05-27
155,27/05/2025,"Modifica composizione della “Cabina di regia presso la Presidenza della Regione Siciliana per fronteggiare lo stato di crisi e di emergenza nel territorio della Regione Siciliana nel settore idrico agricolo/zootecnico e di quello idropotabile civile e produttivo”, istituita con deliberazione della Giunta regionale n. 148 del 9 aprile 2024 e modificata con deliberazione della Giunta regionale n. 313 dell&apos;11 ottobre 2024",presidenza,,,,https://www2.regione.sicilia.it/deliberegiunta/file/giunta/allegati/N.155_27.05.2025.pdf,2025,"Tue, 27 May 2025 00:00:00 +0000",2025-05-27
154,27/05/2025,Ente Autonomo Fiera di Messina in liquidazione coatta amministrativa - Nomina Commissario liquidatore,attivita' produttive,Nomine,,,https://www2.regione.sicilia.it/deliberegiunta/file/giunta/allegati/N.154_27.05.2025%20con%20omissis.pdf,2025,"Tue, 27 May 2025 00:00:00 +0000",2025-05-27
