legislatura,numero,data,titolo,RSSdate,URL
17,998,2021-05-13,Norme in materia di valorizzazione e riclassificazione del personale non dirigenziale della Regione siciliana,"Thu, 13 May 2021 00:00:00 +0000",https://w3.ars.sicilia.it/icaro/default.jsp?icaDB=221&icaQuery=%2817.LEGISL+E+%28998%29.NUMDDL%29
17,1010,2021-05-12,"Abrogazione della legge regionale 21 ottobre 2020, n. 24 'norme per la prevenzione ed il trattamento del disturbo da gioco d'azzardo'","Wed, 12 May 2021 00:00:00 +0000",https://w3.ars.sicilia.it/icaro/default.jsp?icaDB=221&icaQuery=%2817.LEGISL+E+%281010%29.NUMDDL%29
17,1009,2021-05-12,"Norme per il superamento del precariato del comparto agro-forestale e ambientale, acquisizione di nuove competenze. Modifiche ed integrazioni della legge regionale 6 aprile 1996 n. 16 e ss.mm.ii","Wed, 12 May 2021 00:00:00 +0000",https://w3.ars.sicilia.it/icaro/default.jsp?icaDB=221&icaQuery=%2817.LEGISL+E+%281009%29.NUMDDL%29
17,1008,2021-05-12,"Rimozione, dalla toponomastica dei Comuni della Sicilia, dei nomi di autori di stragi perpetrate conto la popolazione civile da parte di ufficiali garibaldini","Wed, 12 May 2021 00:00:00 +0000",https://w3.ars.sicilia.it/icaro/default.jsp?icaDB=221&icaQuery=%2817.LEGISL+E+%281008%29.NUMDDL%29
17,1007,2021-05-9,"Misure sanzionatorie/amministrative per il contrasto agli incendi boschivi nel territorio siciliano, ai sensi degli artt. 423 (incendio) e 423 bis (incendio boschivo) del Codice Penale.","Sun, 09 May 2021 00:00:00 +0000",https://w3.ars.sicilia.it/icaro/default.jsp?icaDB=221&icaQuery=%2817.LEGISL+E+%281007%29.NUMDDL%29
17,1006,2021-05-6,Riorganizzazione strutture private accreditate,"Thu, 06 May 2021 00:00:00 +0000",https://w3.ars.sicilia.it/icaro/default.jsp?icaDB=221&icaQuery=%2817.LEGISL+E+%281006%29.NUMDDL%29
17,1005,2021-05-5,Norme in favore dei lavoratori emigrati e delle loro famiglie,"Wed, 05 May 2021 00:00:00 +0000",https://w3.ars.sicilia.it/icaro/default.jsp?icaDB=221&icaQuery=%2817.LEGISL+E+%281005%29.NUMDDL%29
17,1004,2021-05-5,"Schema di progetto di legge da proporre al Parlamento della Repubblica, ai sensi dell'art.18 dello Statuto della Regione Siciliana recante Modifica art. 1 del D.L. 27/12/1989, n. 413, convertito con modificazioni in Legge 28/02/1990, n. 3 - raggiungimento","Wed, 05 May 2021 00:00:00 +0000",https://w3.ars.sicilia.it/icaro/default.jsp?icaDB=221&icaQuery=%2817.LEGISL+E+%281004%29.NUMDDL%29
17,1003,2021-05-5,Istituzione della giornata del siciliano nel mondo,"Wed, 05 May 2021 00:00:00 +0000",https://w3.ars.sicilia.it/icaro/default.jsp?icaDB=221&icaQuery=%2817.LEGISL+E+%281003%29.NUMDDL%29
17,1002,2021-05-4,Esenzione dall'obbligo di presentazione del Documento Unico di Regolarità Contributiva (DURC) per la partecipazione a gare d'appalto pubbliche,"Tue, 04 May 2021 00:00:00 +0000",https://w3.ars.sicilia.it/icaro/default.jsp?icaDB=221&icaQuery=%2817.LEGISL+E+%281002%29.NUMDDL%29
17,1001,2021-04-29,"Modifiche all'art. 20 della legge regionale 16 aprile 2003, n.4","Thu, 29 Apr 2021 00:00:00 +0000",https://w3.ars.sicilia.it/icaro/default.jsp?icaDB=221&icaQuery=%2817.LEGISL+E+%281001%29.NUMDDL%29
17,1000,2021-04-29,"Disposizioni per la promozione della parità retributiva tra i sessi, il sostegno all'occupazione e all'imprenditoria femminile di qualità, nonché per la valorizzazione delle competenze delle donne","Thu, 29 Apr 2021 00:00:00 +0000",https://w3.ars.sicilia.it/icaro/default.jsp?icaDB=221&icaQuery=%2817.LEGISL+E+%281000%29.NUMDDL%29
17,993,2021-04-28,Istituzione del Centro di restauro del legno bagnato,"Wed, 28 Apr 2021 00:00:00 +0000",https://w3.ars.sicilia.it/icaro/default.jsp?icaDB=221&icaQuery=%2817.LEGISL+E+%28993%29.NUMDDL%29
17,991,2021-04-28,Norme in materia di nuove qualifiche professionali accessibili ai non vedenti e modifiche alla Legge Regionale n. 60/1976,"Wed, 28 Apr 2021 00:00:00 +0000",https://w3.ars.sicilia.it/icaro/default.jsp?icaDB=221&icaQuery=%2817.LEGISL+E+%28991%29.NUMDDL%29
17,990,2021-04-28,Disposizioni per il coordinamento degli interventi contro la povertà e l'esclusione sociale,"Wed, 28 Apr 2021 00:00:00 +0000",https://w3.ars.sicilia.it/icaro/default.jsp?icaDB=221&icaQuery=%2817.LEGISL+E+%28990%29.NUMDDL%29
17,989,2021-04-28,Norme in materia di spettacolo dal vivo,"Wed, 28 Apr 2021 00:00:00 +0000",https://w3.ars.sicilia.it/icaro/default.jsp?icaDB=221&icaQuery=%2817.LEGISL+E+%28989%29.NUMDDL%29
17,982,2021-04-28,"Schema di progetto di legge da proporre al Parlamento della Repubblica ai sensi dell'articolo 18 dello Statuto della Regione recante Modifiche al decreto legislativo 7 settembre 2012, n. 155 Nuova organizzazione dei tribunali ordinari e degli uffici del pu","Wed, 28 Apr 2021 00:00:00 +0000",https://w3.ars.sicilia.it/icaro/default.jsp?icaDB=221&icaQuery=%2817.LEGISL+E+%28982%29.NUMDDL%29
17,999,2021-04-27,Modifiche alla legge regionale n. 29/1951 in materia di preferenza di genere per l'elezione dei deputati all'Assemblea regionale siciliana.,"Tue, 27 Apr 2021 00:00:00 +0000",https://w3.ars.sicilia.it/icaro/default.jsp?icaDB=221&icaQuery=%2817.LEGISL+E+%28999%29.NUMDDL%29
17,997,2021-04-27,Istituzione del servizio di Psicologia di base,"Tue, 27 Apr 2021 00:00:00 +0000",https://w3.ars.sicilia.it/icaro/default.jsp?icaDB=221&icaQuery=%2817.LEGISL+E+%28997%29.NUMDDL%29
17,996,2021-04-27,Interventi assistiti con gli animali. Riabilitazione attraverso l'Ippoterapia,"Tue, 27 Apr 2021 00:00:00 +0000",https://w3.ars.sicilia.it/icaro/default.jsp?icaDB=221&icaQuery=%2817.LEGISL+E+%28996%29.NUMDDL%29
