legislatura,numero,data,titolo,RSSdate,URL
17,1222,2022-04-26,"Schema di progetto di legge costituzionale da proporre al Parlamento della Repubblica ai sensi dell'articolo 41 ter, comma 2, dello Statuto recante 'Modifiche all'articolo 17 dello Statuto della Regione siciliana, in materia di legislazione sociale, rappor","Tue, 26 Apr 2022 00:00:00 +0000",https://w3.ars.sicilia.it/icaro/default.jsp?icaDB=221&icaQuery=%2817.LEGISL+E+%281222%29.NUMDDL%29
17,1221,2022-04-26,Istituzione del Garante regionale per le libertà civili,"Tue, 26 Apr 2022 00:00:00 +0000",https://w3.ars.sicilia.it/icaro/default.jsp?icaDB=221&icaQuery=%2817.LEGISL+E+%281221%29.NUMDDL%29
17,1220,2022-04-26,Disposizioni per garantire l'attuazione di previsioni legislative. Modifiche di norme.,"Tue, 26 Apr 2022 00:00:00 +0000",https://w3.ars.sicilia.it/icaro/default.jsp?icaDB=221&icaQuery=%2817.LEGISL+E+%281220%29.NUMDDL%29
17,1219,2022-04-26,Interventi regionali di promozione e sostegno dell'istituzione dei gruppi di autoconsumo collettivo da fonti rinnovabili e delle comunità energetiche rinnovabili.,"Tue, 26 Apr 2022 00:00:00 +0000",https://w3.ars.sicilia.it/icaro/default.jsp?icaDB=221&icaQuery=%2817.LEGISL+E+%281219%29.NUMDDL%29
17,1234,2022-04-22,Legge di stabilità regionale 2022/2024,"Fri, 22 Apr 2022 00:00:00 +0000",https://w3.ars.sicilia.it/icaro/default.jsp?icaDB=221&icaQuery=%2817.LEGISL+E+%281234%29.NUMDDL%29
17,1233,2022-04-20,Istituzione del Reddito energetico regionale,"Wed, 20 Apr 2022 00:00:00 +0000",https://w3.ars.sicilia.it/icaro/default.jsp?icaDB=221&icaQuery=%2817.LEGISL+E+%281233%29.NUMDDL%29
17,1232,2022-04-20,Combustione controllata di materiale vegetale,"Wed, 20 Apr 2022 00:00:00 +0000",https://w3.ars.sicilia.it/icaro/default.jsp?icaDB=221&icaQuery=%2817.LEGISL+E+%281232%29.NUMDDL%29
17,1231,2022-04-20,"Norme in materia di contrasto alle delocalizzazioni produttive, incentivi alle imprese e sostegno all'imprenditorialità, al fine di salvaguardare i livelli produttivi ed occupazionali","Wed, 20 Apr 2022 00:00:00 +0000",https://w3.ars.sicilia.it/icaro/default.jsp?icaDB=221&icaQuery=%2817.LEGISL+E+%281231%29.NUMDDL%29
17,1230,2022-04-20,Iscrizione delle persone senza dimora nelle liste degli assistiti delle Aziende Sanitarie Locali regionali,"Wed, 20 Apr 2022 00:00:00 +0000",https://w3.ars.sicilia.it/icaro/default.jsp?icaDB=221&icaQuery=%2817.LEGISL+E+%281230%29.NUMDDL%29
17,1229,2022-04-20,"Norme per la riqualificazione, valorizzazione e messa in sicurezza del sistema Costiero siciliano e del patrimonio che vi insiste.","Wed, 20 Apr 2022 00:00:00 +0000",https://w3.ars.sicilia.it/icaro/default.jsp?icaDB=221&icaQuery=%2817.LEGISL+E+%281229%29.NUMDDL%29
17,1224,2022-04-20,Bilancio di previsione della Regione Siciliana per il triennio 2022/2024,"Wed, 20 Apr 2022 00:00:00 +0000",https://w3.ars.sicilia.it/icaro/default.jsp?icaDB=221&icaQuery=%2817.LEGISL+E+%281224%29.NUMDDL%29
17,1228,2022-04-11,Disposizioni in materia di servizi di pronto soccorso e di punti di primo intervento,"Mon, 11 Apr 2022 00:00:00 +0000",https://w3.ars.sicilia.it/icaro/default.jsp?icaDB=221&icaQuery=%2817.LEGISL+E+%281228%29.NUMDDL%29
17,1223,2022-04-8,Norme per il funzionamento degli Ispettorati territoriali del lavoro della Regione Siciliana.,"Fri, 08 Apr 2022 00:00:00 +0000",https://w3.ars.sicilia.it/icaro/default.jsp?icaDB=221&icaQuery=%2817.LEGISL+E+%281223%29.NUMDDL%29
17,1218,2022-04-8,"Riconoscimento della legittimità dei debiti fuori bilancio ai sensi dell'articolo 73, comma 1, lettera e) del decreto legislativo 23 giugno 2011, n. 118 e successive modifiche ed integrazioni. D.F.B. 2022 mese di Febbraio","Fri, 08 Apr 2022 00:00:00 +0000",https://w3.ars.sicilia.it/icaro/default.jsp?icaDB=221&icaQuery=%2817.LEGISL+E+%281218%29.NUMDDL%29
17,1217,2022-04-8,"Riconoscimento della legittimità dei debiti fuori bilancio ai sensi dell'articolo 73, comma 1, lettera a) del decreto legislativo 23 giugno 2011, n. 118 e successive modifiche ed integrazioni. D.F.B. 2022 mese di Febbraio","Fri, 08 Apr 2022 00:00:00 +0000",https://w3.ars.sicilia.it/icaro/default.jsp?icaDB=221&icaQuery=%2817.LEGISL+E+%281217%29.NUMDDL%29
17,1216,2022-04-8,Politiche regionali di mitigazione e adattamento ai cambiamenti climatici. Istituzione dell'Osservatorio Regionale sui Cambiamenti Climatici,"Fri, 08 Apr 2022 00:00:00 +0000",https://w3.ars.sicilia.it/icaro/default.jsp?icaDB=221&icaQuery=%2817.LEGISL+E+%281216%29.NUMDDL%29
17,1215,2022-04-8,Misure finalizzate a promuovere la costituzione delle Comunità energetiche rinnovabili e dei gruppi di autoconsumo collettivo,"Fri, 08 Apr 2022 00:00:00 +0000",https://w3.ars.sicilia.it/icaro/default.jsp?icaDB=221&icaQuery=%2817.LEGISL+E+%281215%29.NUMDDL%29
17,1214,2022-04-8,"Norme in materia di polizia mortuaria, di attività e servizi necroscopici, funebri e cimiteriali","Fri, 08 Apr 2022 00:00:00 +0000",https://w3.ars.sicilia.it/icaro/default.jsp?icaDB=221&icaQuery=%2817.LEGISL+E+%281214%29.NUMDDL%29
17,1213,2022-04-8,"Intervento finanziario per l'adempimento degli obblighi ex art. 30, commi 3 e 6, della legge regionale 23 maggio 1991, n. 36","Fri, 08 Apr 2022 00:00:00 +0000",https://w3.ars.sicilia.it/icaro/default.jsp?icaDB=221&icaQuery=%2817.LEGISL+E+%281213%29.NUMDDL%29
17,1212,2022-04-8,Stabilizzazione precari in servizio presso le Camere di Commercio,"Fri, 08 Apr 2022 00:00:00 +0000",https://w3.ars.sicilia.it/icaro/default.jsp?icaDB=221&icaQuery=%2817.LEGISL+E+%281212%29.NUMDDL%29
