legislatura,numero,data,titolo,RSSdate,URL
17,1018,2021-06-11,Termine ultimo per la presentazione delle istanze di proroga delle concessioni demaniali marittime,"Fri, 11 Jun 2021 00:00:00 +0000",https://w3.ars.sicilia.it/icaro/default.jsp?icaDB=221&icaQuery=%2817.LEGISL+E+%281018%29.NUMDDL%29
17,1022,2021-06-9,Riordino della gestione delle riserve naturali e della rete Natura 2000,"Wed, 09 Jun 2021 00:00:00 +0000",https://w3.ars.sicilia.it/icaro/default.jsp?icaDB=221&icaQuery=%2817.LEGISL+E+%281022%29.NUMDDL%29
17,1021,2021-06-8,"Disposizioni in materia di permessi di ricerca, concessioni e autorizzazioni alla coltivazione di sostanze minerali e da cava di cui all'art. 2 della legge regionale 1 ottobre 1956, n. 54","Tue, 08 Jun 2021 00:00:00 +0000",https://w3.ars.sicilia.it/icaro/default.jsp?icaDB=221&icaQuery=%2817.LEGISL+E+%281021%29.NUMDDL%29
17,1020,2021-06-8,Modifica della Legge Regionale n. 116 del 7 novembre 1980.,"Tue, 08 Jun 2021 00:00:00 +0000",https://w3.ars.sicilia.it/icaro/default.jsp?icaDB=221&icaQuery=%2817.LEGISL+E+%281020%29.NUMDDL%29
17,1019,2021-06-8,"Esclusione delle rivendite di generi di monopolio dai divieti distanziali all'offerta di giochi pubblici. Modifica Legge Regionale n. 24, del 21 ottobre 2020","Tue, 08 Jun 2021 00:00:00 +0000",https://w3.ars.sicilia.it/icaro/default.jsp?icaDB=221&icaQuery=%2817.LEGISL+E+%281019%29.NUMDDL%29
17,1017,2021-06-1,"disposizioni per il recupero, la restituzione e la donazione ai fini del riutilizzo di medicinali in corso di validità nelle farmacie","Tue, 01 Jun 2021 00:00:00 +0000",https://w3.ars.sicilia.it/icaro/default.jsp?icaDB=221&icaQuery=%2817.LEGISL+E+%281017%29.NUMDDL%29
17,1016,2021-05-26,Sponsorizzazione dei beni culturali,"Wed, 26 May 2021 00:00:00 +0000",https://w3.ars.sicilia.it/icaro/default.jsp?icaDB=221&icaQuery=%2817.LEGISL+E+%281016%29.NUMDDL%29
17,1015,2021-05-25,istituzione della figura del difensore civico regionale,"Tue, 25 May 2021 00:00:00 +0000",https://w3.ars.sicilia.it/icaro/default.jsp?icaDB=221&icaQuery=%2817.LEGISL+E+%281015%29.NUMDDL%29
17,1014,2021-05-25,Diversificazione e multifunzionalità dell'impresa agricola,"Tue, 25 May 2021 00:00:00 +0000",https://w3.ars.sicilia.it/icaro/default.jsp?icaDB=221&icaQuery=%2817.LEGISL+E+%281014%29.NUMDDL%29
17,1013,2021-05-21,Disposizioni in materia di attività di tirocinio e formative degli specializzandi presso le strutture ospedaliere delle Aziende Sanitarie Provinciali.,"Fri, 21 May 2021 00:00:00 +0000",https://w3.ars.sicilia.it/icaro/default.jsp?icaDB=221&icaQuery=%2817.LEGISL+E+%281013%29.NUMDDL%29
17,1012,2021-05-21,"Disciplina organica delle attività commerciali, della somministrazione di cibo e bevande, del commercio equo e solidale e delle politiche attive di sostegno al commercio nella Regione Siciliana","Fri, 21 May 2021 00:00:00 +0000",https://w3.ars.sicilia.it/icaro/default.jsp?icaDB=221&icaQuery=%2817.LEGISL+E+%281012%29.NUMDDL%29
17,1011,2021-05-21,"Schema di progetto di legge voto da proporre al Parlamento della Repubblica, ai sensi dell'art.18 dello Statuto della Regione siciliana, recante Delega al Governo per il recepimento delle direttive europee e l'attuazione di altri atti dell'Unione europea -","Fri, 21 May 2021 00:00:00 +0000",https://w3.ars.sicilia.it/icaro/default.jsp?icaDB=221&icaQuery=%2817.LEGISL+E+%281011%29.NUMDDL%29
17,1010,2021-05-21,"Abrogazione della legge regionale 21 ottobre 2020, n. 24 'Norme per la prevenzione ed il trattamento del disturbo da gioco d'azzardo'","Fri, 21 May 2021 00:00:00 +0000",https://w3.ars.sicilia.it/icaro/default.jsp?icaDB=221&icaQuery=%2817.LEGISL+E+%281010%29.NUMDDL%29
17,1009,2021-05-21,"Norme per il superamento del precariato del comparto agro-forestale e ambientale, acquisizione di nuove competenze. Modifiche ed integrazioni della legge regionale 6 aprile 1996 n. 16 e ss.mm.ii","Fri, 21 May 2021 00:00:00 +0000",https://w3.ars.sicilia.it/icaro/default.jsp?icaDB=221&icaQuery=%2817.LEGISL+E+%281009%29.NUMDDL%29
17,1008,2021-05-21,"Rimozione, dalla toponomastica dei Comuni della Sicilia, dei nomi di autori di stragi perpetrate conto la popolazione civile da parte di ufficiali garibaldini","Fri, 21 May 2021 00:00:00 +0000",https://w3.ars.sicilia.it/icaro/default.jsp?icaDB=221&icaQuery=%2817.LEGISL+E+%281008%29.NUMDDL%29
17,994,2021-05-21,"Modifiche all'articolo 5, commi 8, 9 e 15 della legge regionale 12 maggio 2020, n. 9","Fri, 21 May 2021 00:00:00 +0000",https://w3.ars.sicilia.it/icaro/default.jsp?icaDB=221&icaQuery=%2817.LEGISL+E+%28994%29.NUMDDL%29
17,1007,2021-05-13,"Misure sanzionatorie/amministrative per il contrasto agli incendi boschivi nel territorio siciliano, ai sensi degli artt. 423 (incendio) e 423 bis (incendio boschivo) del Codice Penale.","Thu, 13 May 2021 00:00:00 +0000",https://w3.ars.sicilia.it/icaro/default.jsp?icaDB=221&icaQuery=%2817.LEGISL+E+%281007%29.NUMDDL%29
17,1006,2021-05-13,Riorganizzazione strutture private accreditate,"Thu, 13 May 2021 00:00:00 +0000",https://w3.ars.sicilia.it/icaro/default.jsp?icaDB=221&icaQuery=%2817.LEGISL+E+%281006%29.NUMDDL%29
17,1005,2021-05-13,Norme in favore dei lavoratori emigrati e delle loro famiglie,"Thu, 13 May 2021 00:00:00 +0000",https://w3.ars.sicilia.it/icaro/default.jsp?icaDB=221&icaQuery=%2817.LEGISL+E+%281005%29.NUMDDL%29
17,1004,2021-05-13,"Schema di progetto di legge da proporre al Parlamento della Repubblica, ai sensi dell'art. 18 dello Statuto della Regione Siciliana recante Modifica art. 1 del D.L. 27/12/1989, n. 413, convertito con modificazioni in Legge 28/02/1990, n. 3 - Raggiungimento","Thu, 13 May 2021 00:00:00 +0000",https://w3.ars.sicilia.it/icaro/default.jsp?icaDB=221&icaQuery=%2817.LEGISL+E+%281004%29.NUMDDL%29
